date,impact,player,position,report,source_link,source_text,team,url,player_id
2018-09-09 20:18:00,"All four catches came in the first half, including a four-yard touchdown grab with eight seconds remaining in the second quarter. That marked Reed’s first end-zone visit since Week 7 of last year, when he broke out for two touchdowns in a loss to Philadelphia. Reed likely would have done more damage had this been a competitive game, but with Washington running circles around the overmatched Cardinals, there was no reason to air it out in the second half. Finally healthy (knock on wood) after an injury-plagued 2017 campaign, the former Florida Gator is safe to pencil in as a TE1 next week in a mouth-watering matchup against the Colts.",Jordan Reed,TE,Jordan Reed corralled four-of-five targets for 48 yards and a touchdown Sunday in the Redskins’ Week 1 win over the Cardinals.,,,Redskins,http://www.rotoworld.com/recent/nfl/8412/jordan-reed,8412
2018-09-16 17:03:00,"He went most of the first half without drawing a target, finally getting a look from Alex Smith with six minutes to go in the second quarter. Reed came through with five catches for 51 yards after halftime but also committed a costly fumble in the fourth quarter that essentially handed Indy the game. The 28-year-old has always been a productive player when healthy and that should continue to be the case next week when the Redskins host Green Bay at FedEx Field.",Jordan Reed,TE,Jordan Reed handled six-of-eight targets for 55 yards Sunday in the Redskins’ Week 2 loss to the Colts.,,,Redskins,http://www.rotoworld.com/recent/nfl/8412/jordan-reed,8412
2018-09-23 18:17:00,"It was a strong statline on an afternoon where Alex Smith completed just 12 passes. Reed's yardage has now gone up each week, though he has not scored since Week 1. He will have a great shot at rectifying that in Week 5 against the Saints. New Orleans' defense has given back all the gains it made in 2017.",Jordan Reed,TE,Jordan Reed caught 4-of-7 targets for 65 yards in the Redskins' Week 3 win over the Packers.,,,Redskins,http://www.rotoworld.com/recent/nfl/8412/jordan-reed,8412
2018-10-14 17:41:00,"The Panthers are a gorgeous matchup for opposing tight ends, but it was Vernon Davis who took advantage for a wide-open touchdown. Reed did lead the team in targets on a quiet day for Alex Smith. Reed is averaging a modest weekly 4/45 through his first five games, but his usage has remained that of a TE1. There should be big games to come.",Jordan Reed,TE,Jordan Reed caught 5-of-9 targets for 36 yards in the Redskins' Week 6 win over the Panthers.,,,Redskins,http://www.rotoworld.com/recent/nfl/8412/jordan-reed,8412
2018-10-21 21:05:00,"The good news is Reed's 43 yards were a team-high. The bad news is Reed's 43 yards were a team-high. It's easy to say he's a TE1 based on past performance, but that feeling is beginning to waiver with his third consecutive game under 50 yards. He also has yet to eclipse 70 yards in a single outing this season. His usage remains that of a TE1, so owners are still advised to hang tight and hope to weather the storm.",Jordan Reed,TE,Jordan Reed caught 2-of-4 targets for 43 yards in the Redskins' Week 7 win over the Cowboys.,,,,http://www.rotoworld.com/recent/nfl/8412/jordan-reed,8412
2018-10-14 18:03:00,The score was Davis' first of the season. He was left uncovered on a 22-yarder. Davis will pop up for the occasional big play but won't see enough volume for fantasy relevance in the Redskins' Alex Smith-led offense.,Vernon Davis,TE,Vernon Davis caught 3-of-3 targets for 48 yards and a touchdown in the Redskins' Week 6 win over the Panthers.,,,Redskins,http://www.rotoworld.com/recent/nfl/3638/vernon-davis,3638
2018-10-21 21:13:00,"Odd. Even without Jamison Crowder and Paul Richardson Sunday, Davis didn't even see one target. Jordan Reed tied backup RB Kapri Bibbs with a team-high 43 receiving yards. Davis will undoubtedly pop if Reed misses time, but should remain on waivers until that day comes.",Vernon Davis,TE,Vernon Davis failed to record a single target in Washington's Week 7 win over the Cowboys.,,,,http://www.rotoworld.com/recent/nfl/3638/vernon-davis,3638
2018-09-09 18:32:00,"Quinn ankle bent awkwardly on a tackle early in the third quarter. He was carted to the locker room, which is not an encouraging sign. The seventh-round rookie returned two punts for 12 yards prior to exiting. With Quinn done for the day, the Redskins are down to just Jamison Crowder, Josh Doctson and Paul Richardson at receiver.",Trey Quinn,WR,Trey Quinn left Sunday's Week 1 game against the Cardinals with an ankle injury and will not return.,https://twitter.com/Redskins/status/1038913871099060224,Washington Redskins on Twitter,Redskins,http://www.rotoworld.com/recent/nfl/13213/trey-quinn,13213
2018-09-09 19:53:00,"Walker appeared to dislocate his ankle, or at very least break his leg.  Being the warrior he is, Walker waved to fans as he made his way to the locker room on the cart.  Walker finished the game with four catches for 52 yards.  We don't expect to see him back on the field anytime soon.",Delanie Walker,TE,Delanie Walker was carted off the field with a gruesome ankle/leg injury in the fourth quarter of Sunday's Week 1 game in Miami.,,,Titans,http://www.rotoworld.com/recent/nfl/3976/delanie-walker,3976
2018-09-09 21:47:00,"As expected.  Walker had his ankle rolled up underneath a defender, bending it unnaturally, requiring an immediate air cast.  Walker is a warrior but simply can't play through this one.  Walker is signed through 2020 and will be 35 the next time he steps on the field.  Jonnu Smith figures to take over at tight end for the Titans, but Corey Davis is going to gobble up pass-game targets.",Delanie Walker,TE,"NFL Network's Ian Rapoport reports Delanie Walker has been diagnosed with a dislocated ankle along with a fracture and is ""almost certainly"" done for the season.",https://twitter.com/RapSheet/status/1038966003269545984,Ian Rapoport on Twitter,Titans,http://www.rotoworld.com/recent/nfl/3976/delanie-walker,3976
2018-09-16 20:42:00,"Smith was reportedly expected to see ""plenty of opportunities"" without Delanie Walker. In his first post-Walker outing, he was out-targeted 2-0 by Luke Stocker. The Titans won't always have to start their backup quarterback and third-string tackle, so all hope isn't lost for Smith just yet. The 92nd-percentile SPARQ monstrosity will have another week to prove he can produce on a full-time basis.",Jonnu Smith,TE,Jonnu Smith didn't receive a target in the Titans' Week 2 win over the Texans.,,,Titans,http://www.rotoworld.com/recent/nfl/12344/jonnu-smith,12344
2018-09-23 17:25:00,"Smith is a promising talent in theory, but the dysfunctional nature of the passing game in which he plays strips Smith of any streamer appeal in re-draft leagues.",Jonnu Smith,TE,Jonnu Smith caught 1-of-2 targets for nine yards in the Titans' Week 3 win over the Jaguars.,,,Titans,http://www.rotoworld.com/recent/nfl/12344/jonnu-smith,12344
2018-09-30 18:12:00,"Smith continues to play the majority of snaps, but he now has just two catches on seven targets this season. One of his missed connections in this game was a bad drop on third down. He is not an option in redraft leagues.",Jonnu Smith,TE,Jonnu Smith did not haul in either of his targets in the Titans' Week 4 win over the Eagles.,,,Titans,http://www.rotoworld.com/recent/nfl/12344/jonnu-smith,12344
2018-10-07 16:59:00,"Smith has been targeted five times by Marcus Mariota this year, catching none.",Jonnu Smith,TE,Titans TE Jonnu Smith was held catch-less on two targets in Week 5.,,,Titans,http://www.rotoworld.com/recent/nfl/12344/jonnu-smith,12344
2018-10-21 13:35:00,"Smith was tackled just short of the end-zone on one of his catches. He had only three targets, but he's been more involved the last few weeks. The Titans are on a bye in Week 8.",Jonnu Smith,TE,Jonnu Smith caught two passes for 11 yards in Week 7 against the Chargers.,,,,http://www.rotoworld.com/recent/nfl/12344/jonnu-smith,12344
2018-09-09 18:07:00,"Not only did Brate put up a goose egg, but he was also out-snapped 43-24 by teammate and fellow tight O.J. Howard. Dating back to last season, the Harvard alum has totaled an embarrassing 186 yards over his last 10 games. Even at a thin fantasy position, the 27-year-old doesn’t carry much weight.",Cameron Brate,TE,Cameron Brate failed to catch either of his two targets Sunday in the Buccaneers’ Week 1 victory over the Saints.,,,Buccaneers,http://www.rotoworld.com/recent/nfl/10193/cameron-brate,10193
2018-09-16 16:41:00,"Catch-less through two weeks, Brate lacks fantasy value behind O.J. Howard.",Cameron Brate,TE,Cameron Brate was held catch-less in Week 2 against the Eagles.,,,Buccaneers,http://www.rotoworld.com/recent/nfl/10193/cameron-brate,10193
2018-09-30 23:02:00,"Brate has either been Jekyll or Hyde through the Bucs' first four games, being held catchless in Tampa's first two contests only to cross pay dirt in the next two. O.J. Howard (knee) did get knocked out in the second quarter Sunday and wasn't able to return. Brate has historically performed much better with Jameis Winston under center, and he'll arguably be a TE1 against the Falcons' ailing secondary if Howard remains out after the bye.",Cameron Brate,TE,Cameron Brate caught 3-of-4 targets for 29 yards and one touchdown in the Bucs' Week 4 loss to the Bears.,,,Buccaneers,http://www.rotoworld.com/recent/nfl/10193/cameron-brate,10193
2018-10-14 18:18:00,"Even with Howard back, Brate did his fantasy backers proud by catching a touchdown on the opening drive. Jameis Winston showed a lot of trust in his tight end on the throw, and Brate made it count by going up over De’Vondre Campbell for the score. Brate now has a touchdown in three straight games. Unfortunately for his value moving forward, that was his only target as O.J. Howard went for 62 yards. He will be just a TE2 next week against the Browns.",Cameron Brate,TE,Cameron Brate hauled in his only target for a 15-yard touchdown in the Bucs' Week 6 loss to the Falcons.,,,Buccaneers,http://www.rotoworld.com/recent/nfl/10193/cameron-brate,10193
2018-10-21 17:42:00,Brate lost a fumble on one of his three catches that the Bucs were fortunate to not have come back to haunt them. Brate has just 15 targets on the season and only has true fantasy value if something were to happen to O.J. Howard.,Cameron Brate,TE,Cameron Brate caught 3-of-4 targets for 23 yards in Sunday's Week 7 win over the Browns.,,,,http://www.rotoworld.com/recent/nfl/10193/cameron-brate,10193
2018-09-09 17:44:00,James drew the start and opportunity with Vance McDonald still sidelined with a foot injury. He will only be a fringe TE2 option in Week 2 against the Chiefs if McDonald remains inactive.,Jesse James,TE,Steelers TE Jesse James caught 3-of-5 targets for 60 yards in Sunday's Week 1 game versus the Browns.,,,Steelers,http://www.rotoworld.com/recent/nfl/10403/jesse-james,10403
2018-09-16 17:50:00,"James also drew a defensive holding penalty in the end zone. The 100-yard game was the first of James' career, and came in spite of Vance McDonald making his 2018 debut. James was left completely uncovered multiple times by a Chiefs defense preoccupied with stopping Antonio Brown and JuJu Smith-Schuster. Today won't be the last time that happens, but especially with McDonald now involved, James' big days are going to be too difficult to see coming to consider him an appealing TE2 streamer.",Jesse James,TE,Jesse James caught 5-of-5 targets for 138 yards and a touchdown in the Steelers' Week 2 loss to the Chiefs.,,,Steelers,http://www.rotoworld.com/recent/nfl/10403/jesse-james,10403
2018-09-09 20:19:00,"He was essentially invisible on Sunday as the third-year wideout was out-targeted by teammates Chris Thompson, Paul Richardson, Jordan Reed and Jamison Crowder. Doctson definitely has rebound potential next week against a sluggish Indy secondary, but at this point, it’s hard to trust the former first-round pick as anything more than a last-ditch WR4/5.",Josh Doctson,WR,Josh Doctson totaled just one catch for 11 yards on three targets Sunday in Washington’s Week 1 win over the Cardinals.,,,Redskins,http://www.rotoworld.com/recent/nfl/11289/josh-doctson,11289
2018-09-16 17:56:00,"Doctson committed a head-scratching drop in the first quarter but redeemed himself somewhat by beating Pierre Desir for a 14-yard grab down the sideline later in the afternoon. He almost came down with a touchdown about midway through the third quarter, but couldn’t quite pull it in. Doctson’s Week 2 wasn’t anything to write home about, though at least he saw seven targets, good for third-most on the team behind only Chris Thompson (13) and Jordan Reed (eight). The 2016 first-rounder gets the Packers at home in Week 3.",Josh Doctson,WR,Josh Doctson nabbed four-of-seven targets for 37 yards Sunday in the Redskins’ Week 2 loss to Indianapolis.,,,Redskins,http://www.rotoworld.com/recent/nfl/11289/josh-doctson,11289
2018-09-23 18:24:00,Doctson's only production came on two first quarter DPIs totaling 15 yards. Doctson has been an every-down player this season but predictably has zero chemistry with Alex Smith. He's caught five balls for 48 yards in three games. You can safely cut bait in re-draft leagues if you haven't already.,Josh Doctson,WR,Josh Doctson was held without a catch on three targets in the Redskins' Week 3 win over the Packers.,,,Redskins,http://www.rotoworld.com/recent/nfl/11289/josh-doctson,11289
2018-10-14 11:47:00,"Doctson's return comes with Jamison Crowder (ankle) sitting. Doctson, Paul Richardson and Maurice Harris will be the Redskins' three-receiver set against the Panthers. Doctson has predictably shown zero chemistry with Alex Smith and is not an appealing WR4.",Josh Doctson,WR,Josh Doctson (heel) is active for Week 6 against the Panthers.,,,Redskins,http://www.rotoworld.com/recent/nfl/11289/josh-doctson,11289
2018-10-14 17:57:00,Doctson was playing through a questionable tag for a heel injury. The first-round bust has 68 yards this season.,Josh Doctson,WR,Josh Doctson caught 3-of-6 targets for 20 yards in the Redskins' Week 6 win over the Panthers.,,,Redskins,http://www.rotoworld.com/recent/nfl/11289/josh-doctson,11289
2018-10-21 21:06:00,"His 42 yards were a season-high, but it doesn't make him any more fantasy relevant than he was prior to kick-off. Doctson is a candidate to fade away completely once Jamison Crowder and Paul Richardson return.",Josh Doctson,WR,Josh Doctson hauled in 3-of-6 targets for 42 yards in Washington's Week 7 victory over the Cowboys.,,,,http://www.rotoworld.com/recent/nfl/11289/josh-doctson,11289
2018-10-08 22:54:00,"He's either being called ""doubtful"" because the injury is severe enough, or the Redskins are just not going to put him back in with them getting their faces smashed in 43-13 at the start of the fourth quarter.  Before leaving, Richardson caught 4-of-5 targets for 50 yards, making one of the best plays of the night for Washington.  Injuries have been an issue for Richardson this year.",Paul Richardson,WR,Paul Richardson exited Monday night's Week 5 blowout loss to the Saints with a right knee injury and is doubtful to return.,,,Redskins,http://www.rotoworld.com/recent/nfl/9545/paul-richardson,9545
2018-10-14 08:00:00,"The Redskins are a hot mess heading into Week 6 with injuries to most of their top contributors on offense. That includes Richardson, who is feeling the effects of knee and shoulder injuries. If P-Rich sits against Carolina, it will open up snaps for Brian Quick, who would work in three-wide sets alongside Josh Doctson and Maurice Harris. Carolina should be among the highest-owned defenses on DFS sites this week.",Paul Richardson,WR,"According to NFL Network's Ian Rapoport, Paul Richardson (questionable, knee/shoulder) will be a game-time decision Week 6 against the Panthers.",https://twitter.com/RapSheet/status/1051385368606519297,Ian Rapoport on Twitter,Redskins,http://www.rotoworld.com/recent/nfl/9545/paul-richardson,9545
2018-10-14 11:33:00,"Richardson doesn't seem particularly close to 100 percent but will be heavily needed with Jamison Crowder (ankle) on the shelf. Even with Crowder and Chris Thompson sidelined, Richardson is not an attractive WR4 against the Panthers.",Paul Richardson,WR,"Paul Richardson (knee, shoulder) is active for Week 6 against the Panthers.",,,Redskins,http://www.rotoworld.com/recent/nfl/9545/paul-richardson,9545
2018-10-14 17:48:00,Richardson added a two-yard rush. Richardson's score came as he got loose at the back of the end zone as Alex Smith scrambled around for time. The high-dollar free agent addition has 13 catches for 212 yards through five games as a Redskin. That's not going to cut it in fantasy leagues.,Paul Richardson,WR,Paul Richardson caught 3-of-5 targets for 31 yards and a touchdown in the Redskins' Week 6 win over the Panthers.,,,Redskins,http://www.rotoworld.com/recent/nfl/9545/paul-richardson,9545
2018-09-09 20:51:00,"The good news is Davis drew by far a team-high 13 targets.  The bad news is he didn't do much with them, lost Marcus Mariota to a shoulder/elbow injury, and couldn't beat Minkah Fitzpatrick on a touchdown opportunity inside the five-yard line in the first half.  Davis' going-forward outlook will very much depend on Mariota's health.  He'll be far less appealing if Gabbert is forced to start.",Corey Davis,WR,Corey Davis caught 6-of-13 targets for 62 yards in the Titans' Week 1 loss to Miami.,,,Titans,http://www.rotoworld.com/recent/nfl/12169/corey-davis,12169
2018-09-16 19:37:00,"Davis led Tennessee in targets for the second consecutive week, already putting him at the 20-target mark for the year. Though they weren't efficient targets, Davis used his athleticism to catch-and-run for additional yards throughout the day. His ceiling is much lower with Blaine Gabbert under center, but as long as Davis remains the focal point of Tennessee's passing offense, he'll stay a low-end WR2 for the rest of the year.",Corey Davis,WR,Corey Davis caught 5-of-7 targets for 55 yards in the Titans' Week 2 win over the Texans.,,,Titans,http://www.rotoworld.com/recent/nfl/12169/corey-davis,12169
2018-09-23 17:34:00,"Tennessee's passing game was nonexistent, managing 108 yards from Marcus Mariota and Blaine Gabbert combined.  Davis' 34 receiving yards actually led the team.  Davis gets a good Week 4 matchup against a beatable Eagles cornerback unit, but the state of this offense always renders him a high-risk WR3/flex option.",Corey Davis,WR,Corey Davis caught 2-of-4 targets for 34 yards in the Titans' Week 3 win over the Jaguars.,,,Titans,http://www.rotoworld.com/recent/nfl/12169/corey-davis,12169
2018-09-30 16:42:00,"Consistently getting targets, Davis always seemed likely to break out once Marcus Mariota returned to full health, and that is exactly what happened against the Eagles. He had already set a new season-high in yardage by midway through the second quarter, and that was with Mariota missing him for what would have been a long gain. Mariota found him for that long play in the fourth quarter, but that was not the end of the action. Following an Eagles field goal, the Titans needed a touchdown to win, and Davis delivered with a leaping grab with just five seconds left. With Mariota looking healthy, Davis will be a top-24 option next week against the Bills.",Corey Davis,WR,Corey Davis hauled in 9-of-15 targets for 161 yards and a touchdown in the Titans' Week 4 win over the Eagles.,,,Titans,http://www.rotoworld.com/recent/nfl/12169/corey-davis,12169
2018-10-07 16:53:00,"The Titans got Davis matched up with other defenders at times, but he mostly squared off with Bills top CB Tre'Davious White, who handily won their one-on-one draws.  As Tennessee's passing game has gone, Davis' box-score production has gone.  He gets an even tougher Week 6 matchup against Baltimore's shutdown pass defense.",Corey Davis,WR,Corey Davis caught 4-of-6 targets for 49 yards in the Titans' Week 5 loss to the Bills.,,,Titans,http://www.rotoworld.com/recent/nfl/12169/corey-davis,12169
2018-10-14 21:19:00,"Davis fell victim to the Titans' miserable pass protection, hauling in just one catch from Marcus Mariota, who was on his back 11 times throughout the afternoon. The only positive to come from this is that four of Mariota's 15 attempts were directed at Davis. As the Titans' O goes, Davis goes, and both went nowhere in a hurry Sunday. He'll remain a low-end WR2 in Week 7 against the Chargers' secondary.",Corey Davis,WR,Corey Davis vacuumed just one of his four targets for 24 yards in the Titans' Week 6 romping to the Ravens.,,,Titans,http://www.rotoworld.com/recent/nfl/12169/corey-davis,12169
2018-10-21 13:20:00,"It's another rough game from Davis, who was led to 24 yards last week. Davis was out-targeted by Tajae Sharpe and had couldn't come down with an end-zone look in the fourth quarter. He hasn't been on the same page with Marcus Mariota over the last few weeks. Davis will be a WR3 when the Titans come out of their bye in Week 9.",Corey Davis,WR,Corey Davis caught 3-of-7 passes for 10 yards in Week 7 against the Chargers.,,,,http://www.rotoworld.com/recent/nfl/12169/corey-davis,12169
2018-09-09 21:11:00,"He saw a target in the first quarter, then wasn't heard from again.  Until this offense shows any signs of functional ability, Taywan will be waiver-wire material in fantasy leagues.  He played behind Tajae Sharpe in the opener.",Taywan Taylor,WR,Taywan Taylor went catch-less in Week 1 against the Dolphins.,,,Titans,http://www.rotoworld.com/recent/nfl/12203/taywan-taylor,12203
2018-09-16 19:41:00,"Taylor only saw four targets but made the most of one in particular when he shook off several tackles and ran 18 yards for Tennessee's only offensive score of the day. The team's only other touchdown came on a 66-yard direct-snap pass on fourth down from special teamers Dan Cruikshank and Kevin Byard. Taylor still isn't involved enough to consider him a weekly WR3, but his potential was certainly flashed Sunday. He's worth stashing in deeper leagues.",Taywan Taylor,WR,Taywan Taylor caught 3-of-4 targets for 32 yards and one touchdown in the Titans' Week 2 victory over the Texans.,,,Titans,http://www.rotoworld.com/recent/nfl/12203/taywan-taylor,12203
2018-09-23 17:36:00,"Taylor led the Titans in targets, but no one in this pass-catcher corps was ever going to produce on a day where Marcus Mariota and Blaine Gabbert combined for 108 passing yards.  Despite his big-play ability, Taylor has not yet put enough production or usage in the box score for Week 4 fantasy consideration against Philadelphia.",Taywan Taylor,WR,Taywan Taylor caught 4-of-5 targets for 30 yards in the Titans' Week 3 win over the Jaguars.,,,Titans,http://www.rotoworld.com/recent/nfl/12203/taywan-taylor,12203
2018-09-30 18:10:00,"This is the usage fantasy players were hoping for in the first game without Rishard Matthews. Working as the clear No. 2, Taylor was consistently involved all game, and he made perhaps the most important play of the day when he converted a fourth-and-long in overtime with a 19-yard catch along the sideline. Talented as they come and the No. 2 option in an ascending passing game, Taylor should be rostered in all formats.",Taywan Taylor,WR,Taywan Taylor hauled in 7-of-9 targets for 77 yards in the Titans' Week 4 win over the Eagles.,,,Titans,http://www.rotoworld.com/recent/nfl/12203/taywan-taylor,12203
2018-10-07 16:55:00,"Taylor flashed his big-play potential on a gain of 19, but he also cost the Titans with a first-quarter fumble that Buffalo turned into a Josh Allen rushing TD.  And that proved to be more than the difference in the game as Tennessee fell 13-12.  Taylor will be a WR5 in Week 6 against Baltimore's shutdown secondary.",Taywan Taylor,WR,Taywan Taylor caught 3-of-5 targets for 30 yards in the Titans' Week 5 loss to the Bills.,,,Titans,http://www.rotoworld.com/recent/nfl/12203/taywan-taylor,12203
2018-10-14 21:52:00,"Taylor's involvement has only gone downhill since it (coincidently) peaked a few short weeks ago, now seeing him account for just the fourth-most receiving yards on Tennessee. Despite his obvious athletic edge and explosiveness over incumbent No. 2 Tajae Sharpe, the latter was still heavily used and led the Titans in receiving (33 yards). Taylor is unfortunately only worth a stash in deeper leagues at this point.",Taywan Taylor,WR,Taywan Taylor hauled in his only target for a measly 13 yards in the Titans' abysmal Week 6 loss to the Ravens.,,,Titans,http://www.rotoworld.com/recent/nfl/12203/taywan-taylor,12203
2018-10-21 13:30:00,Taylor had a bad drop on what would have been a 20-plus yard catch. He's been a non-factor over the last couple weeks and is behind Tajae Sharpe for targets. Taylor is just a dynasty stash.,Taywan Taylor,WR,Taywan Taylor one pass for eight yards in Week 7 against the Chargers.,,,,http://www.rotoworld.com/recent/nfl/12203/taywan-taylor,12203
2018-09-16 08:32:00,"It appears McDonald will make his season debut Sunday against Kansas City after sitting out the opener with a nagging foot injury. Jesse James filled in for him last week, logging three catches for 60 yards in a tie with Cleveland. Going against a vulnerable Chiefs secondary, McDonald should have a chance to return TE2 value this week.",Vance McDonald,TE,"Vance McDonald (questionable, foot) is expected to play Week 2 against the Chiefs.",https://twitter.com/RapSheet/status/1041237501443301376,Ian Rapoport on Twitter,Steelers,http://www.rotoworld.com/recent/nfl/8413/vance-mcdonald,8413
