date,impact,player,position,report,source_link,source_text,team,url,player_id
2018-09-09 17:19:00,"Even with Leonard Fournette leaving with an injury, Grant did not see much action against the Giants. Perhaps that changes if Fournette is forced to miss time, but T.J. Yeldon is the back to add.",Corey Grant,RB,Corey Grant rushed once for three yards in the Jaguars' Week 1 win over the Giants.,,,Jaguars,http://www.rotoworld.com/recent/nfl/10678/corey-grant,10678
2018-09-16 20:13:00,"Grant ended up forming a near-even committee with T.J. Yeldon in Leonard Fournette's absence. The Jags worked hard to exploit Grant's play-making ability as a pass catcher. He was a spark plug who picked up a number of key first downs. Despite his big-play ability, Grant will be a low-end RB3/FLEX if Fournette remains sidelined for Week 3 against the Titans.",Corey Grant,RB,"Corey Grant caught 6-of-7 targets for 56 yards in the Jaguars' Week 2 win over the Patriots, adding four rushes for 13 additional yards.",,,Jaguars,http://www.rotoworld.com/recent/nfl/10678/corey-grant,10678
2018-09-23 16:07:00,"Grant started the game in place of Leonard Fournette (hamstring), but the Jags wound up going with T.J. Yeldon because Grant was so ineffective.  Grant was barely even seen in the second half, while Yeldon finished with 13 touches to Grant's 7.  All in all, it was an abysmal offensive effort from a Jaguars team that played so well versus New England the week prior.  Fournette was close to playing and figures to return in Week 4 against the Jets.",Corey Grant,RB,Corey Grant rushed six times for 11 yards and caught 1-of-2 targets for a combined loss of one yard in the Jaguars' Week 3 loss to Tennessee.,,,Jaguars,http://www.rotoworld.com/recent/nfl/10678/corey-grant,10678
2018-10-07 13:54:00,"Grant had his lower leg caught underneath a tackler at the end of a second-quarter run. He was not able to put weight on his left leg as he was helped off the field, and he was pretty quickly ruled out. With Leonard Fournette inactive, T.J. Yeldon should get as much work as he can handle against the Chiefs. Brandon Wilds is Jacksonville's other active running back.",Corey Grant,RB,Corey Grant exited Week 5 against the Chiefs with a foot injury.,,,Jaguars,http://www.rotoworld.com/recent/nfl/10678/corey-grant,10678
2018-10-07 18:23:00,"Grant had to be carted off the field Sunday.  He was hyped up over the summer as someone the Jaguars wanted to get more involved in the offense, but it never really happened as Grant got 13 carries and turned them into 40 scoreless yards.  Grant nabbed nine catches for 67 yards.  He'll be a 27-year-old free agent next March coming off one of the most serious foot injuries.",Corey Grant,RB,ESPN's Adam Schefter reports Corey Grant suffered a Lisfranc injury Week 5 against the Chiefs and is expected to miss the remainder of the season.,https://twitter.com/AdamSchefter/status/1049061425937825797,Adam Schefter on Twitter,Jaguars,http://www.rotoworld.com/recent/nfl/10678/corey-grant,10678
2018-09-30 22:12:00,The second-year UDFA was sprung into extra snaps with Marquise Goodwin and Dante Pettis both leaving the game with leg injuries. Bourne was able to convert the extra looks into a two-yard touchdown for his second touchdown of the year. He will return to his backup role once Goodwin and Pettis return to action.,Kendrick Bourne,WR,Kendrick Bourne caught 3-of-4 targets for 34 yards and a touchdown in the 49ers' Week 4 loss to the Chargers.,http://www.espn.com/nfl/story/_/id/23786801/surprise-offseason-camp-standouts-know-32-nfl-teams-2018,ESPN.com,,http://www.rotoworld.com/recent/nfl/12677/kendrick-bourne,12677
2018-09-23 08:43:00,Yeldon will play through his ankle injury and figures to carry the load Sunday with workhorse Leonard Fournette (hamstring) headed for another absence. Tennessee's run defense doesn't pose much of a threat as the Titans have yielded the seventh-most rushing yards per game this season. Yeldon is worth firing up as a borderline RB2 in all fantasy leagues this week.,T.J. Yeldon,RB,"T.J. Yeldon (questionable, ankle) is expected to play Week 3 against the Titans.",https://twitter.com/AdamSchefter/status/1043841392471166976,Adam Schefter on Twitter,Jaguars,http://www.rotoworld.com/recent/nfl/10311/tj-yeldon,10311
2018-09-23 16:08:00,"The Jaguars started Corey Grant, but he managed 10 yards on seven touches and Yeldon showed the hotter hand.  In a game where Jacksonville's passing attack was almost entirely nonexistent, Yeldon led the team in receiving yards.  Leonard Fournette (hamstring) is tentatively due back for Week 4 against the Jets, which would render Yeldon and Grant useless as fantasy options.",T.J. Yeldon,RB,T.J. Yeldon rushed seven times for 44 yards and caught 6-of-7 targets for 46 yards in the Jaguars' Week 3 loss to Tennessee.,,,Jaguars,http://www.rotoworld.com/recent/nfl/10311/tj-yeldon,10311
2018-09-30 16:41:00,"Yeldon replaced an injured Leonard Fournette in the second quarter.  He went untouched on a 31-yard screen for his first touchdown, and added a one-yard goal-line TD in mopup time. With Fournette dealing with a setback, Yeldon could be in line for another start this week. He'll be a plug-and-play RB2 if Fournette sits.",T.J. Yeldon,RB,T.J. Yeldon had 18 carries for 52 yards and a touchdown and caught three passes for 48 yards and a receiving touchdown in Week 4 against the Jets.,,,Jaguars,http://www.rotoworld.com/recent/nfl/10311/tj-yeldon,10311
2018-10-07 17:31:00,"With Corey Grant exiting early, it was all Yeldon in this one. He looked great early in the game, consistently gaining big yardage on the ground. That stopped with the Jaguars down big in the second half, but he kept things going in the passing game. He caught Blake Bortles' only touchdown pass when he easily beat a linebacker on a wheel route from 14 yards out. With Leonard Fournette looking doubtful for Week 6, Yeldon will be a high-end RB2 against the Cowboys.",T.J. Yeldon,RB,T.J. Yeldon rushed 10 times for 53 yards and hauled in 8-of-10 targets for 69 yards and a touchdown in the Jaguars' Week 5 loss to the Chiefs.,,,Jaguars,http://www.rotoworld.com/recent/nfl/10311/tj-yeldon,10311
2018-10-14 19:56:00,"Yeldon never had a chance with Jacksonville playing from behind almost the entire game. With the Jags in catch-up mode, Yeldon saw just three carries in the second half. The 25-year-old has served as Jacksonville's workhorse during Leonard Fournette's absence. If Fournette (hamstring) can't get the green light in Week 7, Yeldon would draw another start against Houston.",T.J. Yeldon,RB,T.J. Yeldon contributed just 41 yards on eight carries while turning five targets into three catches for 29 yards Sunday in Jacksonville’s Week 6 loss to the Cowboys.,,,Jaguars,http://www.rotoworld.com/recent/nfl/10311/tj-yeldon,10311
2018-10-21 17:37:00,"Yeldon operated as Jacksonville’s feature back for one last week; Carlos Hyde will likely take over as the Jags’ primary ball carrier in Week 8 against the Eagles in London. Yeldon should continue to dominate passing-game work until Leonard Fournette (hamstring) returns, but he has devolved from an every-week RB2 to a low-end flex option going forward.",T.J. Yeldon,RB,T.J. Yeldon rushed 12 times for 28 yards and caught 5-of-7 targets for 40 yards and a touchdown in the Jaguars’ Week 7 loss to Houston.,https://twitter.com/TDickman89/status/1052560041331580938,Tad Dickman on Twitter,,http://www.rotoworld.com/recent/nfl/10311/tj-yeldon,10311
2018-10-21 11:35:00,"Perriman will make his Browns debut with Rishard Higgins (MCL) still sidelined. He'll be at best the No. 4 wideout behind Jarvis Landry, Antonio Callaway, and Damion Ratley. Inactive for Cleveland are QB Drew Stanton, WR Da’Mari Scott, CB E.J. Gaines, MLB Joe Schobert, and DL Carl Davis.",Breshad Perriman,WR,Breshad Perriman is active for Week 7 against the Bucs.,https://twitter.com/AdamSchefter/status/1051133554133008384,Adam Schefter on Twitter,,http://www.rotoworld.com/recent/nfl/10357/breshad-perriman,10357
2018-09-09 20:17:00,Pro Football Focus charted Gates as playing 33-of-82 snaps. His production was identical to Virgil Green's. Gates will be on the TE2 radar for Week 2 against a Bills defense that struggled to defend the middle of the field last season.,Antonio Gates,TE,Antonio Gates caught 2-of-3 passes for 16 yards in the Chargers' Week 1 loss to the Chiefs.,,,Chargers,http://www.rotoworld.com/recent/nfl/611/antonio-gates,611
2018-09-16 17:20:00,He had just one target. Gates has been an afterthought in the Chargers' offense after two catches in the season opener. He's droppable in fantasy leagues.,Antonio Gates,TE,Antonio Gates was held without a catch in Week 2 against Buffalo.,,,Chargers,http://www.rotoworld.com/recent/nfl/611/antonio-gates,611
2018-09-23 08:41:00,Gates missed practice time this week due to an illness but he's going to gut it out on Sunday. The veteran has played limited snaps this year and is unlikely to be a factor against the Rams' elite secondary. The 38-year-old no longer carries any fantasy significance.,Antonio Gates,TE,"Antonio Gates (questionable, illness) is expected to play Week 3 against the Rams.",https://twitter.com/AdamSchefter/status/1043791334665048065,Adam Schefter on Twitter,Chargers,http://www.rotoworld.com/recent/nfl/611/antonio-gates,611
2018-09-23 14:38:00,"The Chargers inactive list confirms Adam Schefter's report that Gates is available to play against the Rams. The Chargers, however, will be without WR Travis Benjamin (foot), LB Emmanuel Ellerbee, C Cole Toner, RT Joe Barksdale, G Forrest Lamp, DT T.Y. McGill, and DE Joey Bosa, who is expected to miss multiple weeks.",Antonio Gates,TE,Antonio Gates (illness) is officially active for Week 3 against the Rams.,https://twitter.com/Chargers/status/1043930539764240384,Chargers on Twitter,Chargers,http://www.rotoworld.com/recent/nfl/611/antonio-gates,611
2018-09-23 20:58:00,"The five targets are a season-high for the veteran tight end. Gates' red zone ability could lead him to a few touchdowns this year, but the 38-year-old is off the fantasy radar with how little volume he has seen.",Antonio Gates,TE,Antonio Gates caught 3-of-5 targets for 45 yards in the Chargers' Week 3 loss to the Rams.,,,Chargers,http://www.rotoworld.com/recent/nfl/611/antonio-gates,611
2018-09-30 21:44:00,"That's back-to-back games with five targets, but he was able to score a touchdown this time around when he escaped to the corner of the end zone without a defender in sight. Gates is a touchdown-dependent TE2, but there should be a couple touchdown opportunities next week against the Raiders.",Antonio Gates,TE,Antonio Gates caught 2-of-5 targets for 26 yards and a touchdown in the Chargers' Week 4 win over the 49ers.,,,Chargers,http://www.rotoworld.com/recent/nfl/611/antonio-gates,611
2018-10-07 20:33:00,"Gates remains a touchdown-dependent streamer as he's posted just 7-90-1 in the Chargers' last three games. With his weekly snaps continuously getting eaten into by fellow tight end Virgil Green (1-13-1), Gates can stay on the wire until the utmost perfect matchup presents itself.",Antonio Gates,TE,Antonio Gates caught both of his targets for 19 yards in the Chargers' Week 5 win over the Raiders.,https://twitter.com/Chargers/status/1043930539764240384,Chargers on Twitter,,http://www.rotoworld.com/recent/nfl/611/antonio-gates,611
2018-10-07 17:59:00,"St. Brown made the start as the No. 3 wideout with Randall Cobb and Geronimo Allison out.  He made a sliding 17-yard grab for his first NFL catch and had a late 54-yard pickup to pad the stats.  St. Brown will head back to the bench when Cobb and/or Allison come back, maybe as soon as Week 6.",Equanimeous St. Brown,WR,Equanimeous St. Brown caught 3-of-5 targets for 89 yards in the Packers' Week 5 loss to the Lions.,,,Packers,http://www.rotoworld.com/recent/nfl/13145/equanimeous-st-brown,13145
2018-09-16 11:52:00,"Callaway replaces Josh Gordon opposite Jarvis Landry. The Browns surprisingly gave Rashard Higgins more snaps than Callaway in Week 1, but with Gordon gone, Callaway will take over in two-wide sets. Callaway has a tough matchup against Marshon Lattimore this week, but his season outlook is on the rise.",Antonio Callaway,WR,Antonio Callaway is starting Week 2 against the Saints.,https://twitter.com/TonyGrossi/status/1041349916990361600,Tony Grossi on Twitter,Browns,http://www.rotoworld.com/recent/nfl/13108/antonio-callaway,13108
2018-09-16 17:08:00,"Starting for Josh Gordon, Callaway failed to draw a target in the first half Sunday, but made his presence felt in the second half when he had catches of 18, 47 and 16 yards. The highlight of his day was reeling in a 47-yard vertical shot on 4th down to tie the game late in the 4th quarter. Callaway will provide uneven production moving forward as a secondary option in the Cleveland passing game, but his season is trending upwards with the Browns moving on from Josh Gordon and should be looked at in deeper leagues. The Browns will host the Jets on Thursday Night in Week 3.",Antonio Callaway,WR,Antonio Callaway caught 3-of-4 targets for 81 yards and a touchdown in Sunday's Week 2 loss to the Saints.,,,Browns,http://www.rotoworld.com/recent/nfl/13108/antonio-callaway,13108
2018-09-20 23:54:00,"Callaway should have had a much bigger night, but Tyrod Taylor missed him on a gimme 75-yard touchdown in the first half. He also committed a few drops and quit on a route that might have resulted in a catch. It was a decidedly mixed effort from the Browns' new starting wideout, but his easy speed was on prominent display. With Baker Mayfield taking over at quarterback, Callaway could quickly push for WR3 status in fantasy leagues.",Antonio Callaway,WR,Antonio Callaway caught 4-of-10 targets for 20 yards in the Browns' Week 3 win over the Jets.,,,Browns,http://www.rotoworld.com/recent/nfl/13108/antonio-callaway,13108
2018-09-30 20:56:00,"It was an eventful day at the office for Callaway, who committed several drops and nearly lost a fumble on a fourth-quarter punt return, but Cleveland recovered.  Callaway nearly hit pay dirt on a 51-yard reception, only to be tackled down at the one-yard line before Carlos Hyde punched it in.  The good news is Callaway has commanded nine and ten targets in the last two games; the bad news is he has only 74 scoreless yards to show for it.  Callaway will remain an exciting-if-volatile WR4/flex option in Week 5 against the Ravens, who are getting back suspended top CB Jimmy Smith.",Antonio Callaway,WR,Antonio Callaway caught 3-of-9 targets for 54 yards in the Browns' Week 4 loss to the Raiders.,,,Browns,http://www.rotoworld.com/recent/nfl/13108/antonio-callaway,13108
2018-10-07 18:01:00,"After a dreadful performance a week ago, Callaway once again struggled on Sunday, dropping a crucial pass. Callaway entered the week dealing with a knee issue and the coaching staff mentioned dialing back his workload, which they did after he received nine and 11 targets over the two games prior. Callaway now has four or fewer receptions in every game this season and is still only a bench stash at this stage of the season. The Browns host the Chargers in Week 6.",Antonio Callaway,WR,Antonio Callaway caught 3-of-5 targets for 22 yards in Sunday's Week 5 win over the Ravens.,,,Browns,http://www.rotoworld.com/recent/nfl/13108/antonio-callaway,13108
2018-10-14 17:20:00,"Callaway once again struggled with missed opportunities as he lost a potential 45-yard touchdown in the sun in the first quarter and then had another straight drop on a potential long-gainer in the second half. He did secure a two-point conversion after the Browns' lone touchdown on the day. Callaway will continue to be force-fed targets as Cleveland has limited healthy bodies available at the wide receiver position, but he has caught just 8-of-24 targets over the past three weeks for 85 yards. Callaway will be an all-or-nothing option against a giving Tampa Bay defense in Week 7.",Antonio Callaway,WR,Antonio Callaway caught 2-of-10 targets for nine yards in Sunday's Week 6 loss to the Chargers.,,,Browns,http://www.rotoworld.com/recent/nfl/13108/antonio-callaway,13108
2018-10-21 18:17:00,The two targets were the fewest that Callaway has received in a game since Week 1. He now has three or fewer receptions in every game on the season but one. Callaway has now reeled in just 9-of-23 targets for 99 yards over Baker Mayfield's four starts. Callaway is not a fantasy option heading into Week 8 against the Steelers.,Antonio Callaway,WR,Antonio Callaway caught 1-of-2 targets for 14 yards in Sunday's Week 7 loss to the Buccaneers.,,,,http://www.rotoworld.com/recent/nfl/13108/antonio-callaway,13108
2018-10-14 19:44:00,"The sixth-round pick from Texas A&M was forced to step up into a large role in the Cleveland passing game with all of the injuries the Browns have sustained at the wide receiver position. His productive game came in game in which Jarvis Landry caught just two passes, so it should be taken with some degree of salt. That said, the Browns will still be without Rishard Higgins for a the short term and Antonio Callaway has proven to be an unreliable option. Ratley is only an option in the deepest of leagues, but the Browns face a terrible Tampa Bay defense on the road in Week 7 for those that must dig that deep.",Damion Ratley,WR,Damion Ratley caught 6-of-8 targets for 82 yards in Sunday's Week 6 loss to the Chargers.,https://www.ohio.com/akron/sports/browns-sign-draft-picks-austin-corbett-damion-ratley-and-simeon-thomas-to-rookie-contracts,Akron Beacon-Journal,,http://www.rotoworld.com/recent/nfl/13281/damion-ratley,13281
2018-09-16 16:55:00,"After 15 targets in Week 1, we expected Landry to come to close to that number once again with the Browns shelving Josh Gordon, but that was not the case on Sunday. He still managed five receptions, the 19th consecutive game in which he's had at least five or more catches, the longest streak in the league. Landry will remain a strong WR2 asset Week 3 against the Jets.",Jarvis Landry,WR,Jarvis Landry caught 5-of-7 targets for 69 yards in Sunday's Week 2 loss to the Saints.,,,Browns,http://www.rotoworld.com/recent/nfl/9405/jarvis-landry,9405
2018-09-20 08:31:00,"Landry was limited all week in practice, but it always seemed like he was just getting some rest on a short week. Certain to get targets in a good matchup, Landry is a solid WR2.",Jarvis Landry,WR,ESPN's Dianna Russini reports Jarvis Landry (knee) is expected to play Thursday night against the Jets.,https://twitter.com/diannaESPN/status/1042752056241676288,Dianna Russini on Twitter,Browns,http://www.rotoworld.com/recent/nfl/9405/jarvis-landry,9405
2018-09-20 18:52:00,"Landry just needed some maintenance during the week. He will be his usual, highly-targeted WR2 self against the Jets. Inactive for the Browns are QB Drew Stanton, WR Rod Streater, LB Christian Kirksey, TE Seth DeValve, DL Emmanuel Ogbah, DL Ifeadi Odenigb and DL Devaroe Lawrence.",Jarvis Landry,WR,Jarvis Landry (knee) is active for Week 3 against the Jets.,,,Browns,http://www.rotoworld.com/recent/nfl/9405/jarvis-landry,9405
2018-09-20 23:49:00,"Landry committed a drop but was helping Baker Mayfield move the chains for the Browns' transformed offense after Tyrod Taylor (concussion) was forced from the game. Landry was the lone Brown getting his numbers while Taylor was under center, but his fantasy fortunes should improve with Mayfield taking over. Landry has a soft Week 4 matchup in the Raiders.",Jarvis Landry,WR,Jarvis Landry caught 8-of-15 targets for 103 yards in the Browns' Week 3 win over the Jets.,,,Browns,http://www.rotoworld.com/recent/nfl/9405/jarvis-landry,9405
2018-09-30 21:10:00,"Landry's ten targets led the team, but he was part of the problem in Cleveland's drop-pass fest and failed to get loose for any big plays.  Finishing with four catches snapped Landry's streak of catching five or more balls in 20 straight games.  Still, Landry has been targeted 18 times in roughly six quarters by Baker Mayfield, by far most on the team.  Keep rolling him out there in Week 5 against a Ravens defense struggling to slow slot receivers.",Jarvis Landry,WR,Jarvis Landry caught 4-of-10 targets for 34 yards and a touchdown in the Browns' Week 4 loss to Oakland.,,,Browns,http://www.rotoworld.com/recent/nfl/9405/jarvis-landry,9405
2018-10-07 17:51:00,"Landry was held in check by a Baltimore secondary. He had just one catch for 10 yards in the first half and needed receptions of 27 and 17 yards on the final three drives of the game to turn in a respectable line. Landry has had two 100-yard game surrounding three lackluster games, but is averaging a career-high 13.0 yards per catch with at double-digit targets in four of the first five games. He is strong WR2 in Week 6 against the Chargers.",Jarvis Landry,WR,Jarvis Landry caught 5-of-10 targets for 69 yards in Sunday's Week 5 win over the Ravens.,,,Browns,http://www.rotoworld.com/recent/nfl/9405/jarvis-landry,9405
2018-10-14 17:01:00,"Landry was stymied by the Chargers secondary all afternoon. His two receptions were the fewest he's had in a game since Week 14 of the 2015 season. Landry has struggled in the transition over to Baker Mayfield catching 11-of-29 targets for 114 yards over Mayfield's three starts. Despite those lowly numbers, Landry will be  in a spot to bounce back against a giving Tampa Bay secondary in Week 7.",Jarvis Landry,WR,Jarvis Landry caught 2-of-9 targets for 11 yards in Sunday's Week 6 loss to the Chargers.,,,Browns,http://www.rotoworld.com/recent/nfl/9405/jarvis-landry,9405
2018-10-21 18:06:00,"After just 11 catches for 114 yards over Baker Mayfield's first three starts, Landry had a season-high 10 catches on Sunday. Things started slowly as Landry had just four catches for 23 yards at the break, but then came on strong in the second half, securing 6-of-8 targets for 73 yards and a score. Landry found the end zone for the second time this season, a 16-yard score in which he made a diving catch and extended the ball over the goal line on his way to the ground to tie the game with 2:28 left in regulation. Landry has double-digit targets in every game this season and heads to Pittsburgh in Week 8 after already having a 100-yard game versus the Steelers in Week 1.",Jarvis Landry,WR,Jarvis Landry caught 10-of-15 targets for 97 yards and a touchdown in Sunday's Week 7 loss to the Buccaneers.,,,,http://www.rotoworld.com/recent/nfl/9405/jarvis-landry,9405
2018-09-30 11:59:00,"He's replacing Randall Cobb (hamstring) in three-wide sets. Cobb was playing 90 percent of snaps before going down, so Valdes-Scantling is going to get some serious run.  With Cobb potentially looking at a multi-game absence, Valdes-Scantling's dynasty stock is on the rise.",Marquez Valdes-Scantling,WR,Marquez Valdes-Scantling will start in Week 4 against Buffalo.,https://twitter.com/thekellyprice/status/1046423033274150913,Kelly Price on Twitter,Packers,http://www.rotoworld.com/recent/nfl/13280/marquez-valdes-scantling,13280
2018-10-07 17:06:00,"With Randall Cobb (hamstring) and Geronimo Allison (concussion) inactive, Valdes-Scantling and fellow rookie Equanimeous St. Brown got the starts next to Davante Adams. MVS scored a three-yard touchdown on the opening drive of the third quarter after the Packers were shut out in the first two frames, and he had a second touchdown called back as it was ruled he was down at the half-yard line. Lance Kendricks scored the next play.  Valdes-Scantling's 10 targets were third on the team behind Adams (12) and Jimmy Graham (11).  Allison will likely be back Week 6, but Cobb may have a multi-week injury.  Once both are back, MVS will be irrelevant in redraft leagues.",Marquez Valdes-Scantling,WR,Marquez Valdes-Scantling caught 7-of-10 targets for 68 yards and one touchdown in the Packers' Week 5 loss to the Lions.,,,Packers,http://www.rotoworld.com/recent/nfl/13280/marquez-valdes-scantling,13280
2018-09-09 17:55:00,"Hyde added three yards on one catch. He ran just nine times for 26 yards in the first half before having a positive drive in the 3rd quarter where he carried four times for 30 yards a touchdown. The Browns offensive line appears to be a real problem for generating consistent yardage, but Hyde handled 22-of-30 Cleveland rushing attempts to open the season. Hyde will be an RB2 option next week on the road versus the Saints.",Carlos Hyde,RB,Browns RB Carlos Hyde rushed 22 times for 62 yards and a touchdown in Sunday's Week 1 game versus the Steelers.,,,Jaguars,http://www.rotoworld.com/recent/nfl/9381/carlos-hyde,9381
2018-09-16 16:58:00,"Hyde added one catch for seven yards in the passing game. It was the second-consecutive game where Hyde struggled on the ground, but was bailed out by a 1-yard rushing score, this time following a pass interference in the end zone. Hyde has now rushed 38 times for 108 yards through two games. He will remain a fringe RB2 in Week 3 versus the Jets.",Carlos Hyde,RB,Carlos Hyde rushed 16 times for 43 yards and touchdown in Sunday's Week 2 loss to the Saints.,,,Jaguars,http://www.rotoworld.com/recent/nfl/9381/carlos-hyde,9381
2018-09-20 19:01:00,"Aka, Hyde is going to have a police escort to the stadium. Hyde's significant other was reportedly induced last night, so it has been a long day for the Browns' feature back. As any new parent can attest, the adrenaline should be enough to get him through the game against the Jets. We are not adjusting his Week 3 rank.",Carlos Hyde,RB,NFL Network's Omar Ruiz reports Carlos Hyde is awaiting the birth of his child on Thursday evening but is expected to make it to FirstEnergy Stadium just before kickoff.,https://twitter.com/OmarDRuiz/status/1042909519188291584,Omar Ruiz on Twitter,Jaguars,http://www.rotoworld.com/recent/nfl/9381/carlos-hyde,9381
