date,impact,player,position,report,source_link,source_text,team,url,player_id
2018-10-21 18:12:00,"Funchess’ touchdown came on a sluggo route to beat Eagles top CB Ronald Darby from 18 yards away. Funchess came out of Michigan younger than most prospects and needed a few years to develop as a rotational receiver, but he is a legit No. 1 at this point. And he has stayed productive despite Greg Olsen’s (foot) return. Nevertheless, Funchess will be more WR3 than WR2 when the Panthers host a stingy Ravens defense next.",Devin Funchess,WR,Devin Funchess caught 6-of-11 targets for 62 yards and a touchdown in the Panthers’ Week 7 win over the Eagles.,,,,http://www.rotoworld.com/recent/nfl/10391/devin-funchess,10391
2018-09-10 23:33:00,"Jones was targeted on a couple deep balls, but he and Matthew Stafford were unable to hook up on any big plays against an underrated Jets secondary.  Better days are obviously ahead.  Jones will be a WR2 next week in San Francisco.",Marvin Jones,WR,Marvin Jones caught 4-of-8 targets for 54 yards in the Lions' Week 1 loss to the Jets.,,,Lions,http://www.rotoworld.com/recent/nfl/7503/marvin-jones,7503
2018-09-16 20:06:00,"Jones routinely created separation from the Niners' secondary but Matthew Stafford couldn’t find his deep ball on Sunday. The most egregious misfire from Stafford came in the second quarter when Jones had nothing but green grass in front of him but the two couldn’t connect. That must have been frustrating for fantasy owners, though Stafford delivered a peace offering in the form of a five-yard touchdown pass to Jones with 8:36 left in the fourth quarter. Jones has now caught exactly four passes for 54 yards in each of his first two games. Say what you will about Marvin, but at least the man's consistent. Jones and the Lions will host the Patriots in Week 3.",Marvin Jones,WR,Marvin Jones hauled in four catches for 54 yards and a touchdown Sunday in the Lions’ Week 2 loss to the 49ers.,,,Lions,http://www.rotoworld.com/recent/nfl/7503/marvin-jones,7503
2018-09-23 09:01:00,"Jones was a late addition to the injury report, getting in a limited practice Friday. He'll be monitored throughout the day, but it sounds like the Lions are expecting him to play. Jones was getting outsnapped by Kenny Golladay before going down and could see his role scaled back at less than 100 percent. He can't be trusted in Week 3 lineups.",Marvin Jones,WR,"NFL Network's Ian Rapoport reports ""there's optimism"" Marvin Jones (questionable, ankle) plays in Sunday night's game with the Patriots.",https://twitter.com/RapSheet/status/1043843826320900096,Ian Rapoport on Twitter,Lions,http://www.rotoworld.com/recent/nfl/7503/marvin-jones,7503
2018-09-23 19:03:00,"Darius Slay (concussion) is also active after being listed as questionable. Jones went down late in the practice week and came down to a game-time decision, so his snaps may be limited. The Lions will be without Ziggy Ansah (shoulder) for Sunday night's game. Ameer Abdullah, DE Kerry Hyder, OG Joe Dahl, OT Andrew Donnal and WR Brandon Powell are also inactive.",Marvin Jones,WR,Marvin Jones (ankle) is active for Week 3 against the Patriots.,,,Lions,http://www.rotoworld.com/recent/nfl/7503/marvin-jones,7503
2018-09-23 23:48:00,"Jones started and looked close to 100 percent playing through his ankle injury. He got wide open out of the slot for a deep 33-yard touchdown for his only highlight of the night. Jones finished behind Golden Tate (8) and Kenny Golladay (7) in targets, but there hasn't been much dropoff from his strong 2017. Jones is a FLEX play for Week 4 against the Cowboys.",Marvin Jones,WR,Marvin Jones caught 4-of-6 passes for 69 yards and a touchdown in Week 3 against the Patriots.,,,Lions,http://www.rotoworld.com/recent/nfl/7503/marvin-jones,7503
2018-09-30 17:33:00,"Jones made a highlight-reel catch in the second quarter, pulling in an absurd over-the-shoulder grab to beat Chidobe Awuzie for a 34-yard pickup. He was targeted in the end zone later in the half but the pass from Matthew Stafford was off the mark. Jones hasn’t had a blow-up game yet in 2018 and it’s fair to expect fewer of those this season with Kenny Golladay becoming a bigger part of the Lions’ passing game. Of course, both of them took a backseat to Golden Tate (8-132-2) on Sunday. Jones will be a mere WR3 next week against the Packers.",Marvin Jones,WR,Marvin Jones chipped in with three catches for 56 yards on six targets Sunday in the Lions’ Week 4 loss to the Cowboys.,,,Lions,http://www.rotoworld.com/recent/nfl/7503/marvin-jones,7503
2018-10-07 11:36:00,"Jones was a late addition to the injury report during the week but is good enough to go in the NFC North tilt.  At less than 100 percent and with Kenny Golladay and Golden Tate balling, Jones is a boom-bust WR3 play.",Marvin Jones,WR,Marvin Jones (ankle) is active for Week 5 against the Packers.,,,Lions,http://www.rotoworld.com/recent/nfl/7503/marvin-jones,7503
2018-10-07 17:55:00,"Playing through an ankle injury, Jones made his one catch count with a diving touchdown in the back of the end zone.  He almost had a second score from 42 yards out on a shot play when the defense jumped offside, but Jones was unable to control the ball through the ground after diving for it.  Jones gets a week to rest and get healthy with the Lions heading into their bye.",Marvin Jones,WR,Marvin Jones caught an eight-yard touchdown on four targets in the Lions' Week 5 win over the Packers.,,,Lions,http://www.rotoworld.com/recent/nfl/7503/marvin-jones,7503
2018-10-21 17:00:00,"Jones also drew a 25-yard DPI. It was a quiet day for the Lions' entire receiver corps, but Jones now has just 93 yards over his past three games. He is averaging a disappointing 45 on the year. Jones should still have blow-up games, but Kenny Golladay's emergence has rendered him a low-end WR3 in fantasy.",Marvin Jones,WR,Marvin Jones caught 3-of-4 targets for 29 yards in the Lions' Week 7 win over the Dolphins.,https://twitter.com/AdamSchefter/status/1048778037364449280,Adam Schefter on Twitter,,http://www.rotoworld.com/recent/nfl/7503/marvin-jones,7503
2018-09-10 23:30:00,"Tate had a real quiet first half and dropped a couple balls this evening, but he did score the Lions' only offensive touchdown.  The Lions marched right down the field on the first possession of the third quarter, with Tate capping it off with a 24-yard touchdown.  Tate's 15 targets were three more than Kenny Golladay and seven more than Marvin Jones to lead the team.  Fire Tate up as a WR2 with upside next week in a mouthwatering date against the 49ers.",Golden Tate,WR,Golden Tate caught 7-of-15 targets for 79 yards and one touchdown in the Lions' Week 1 loss to the Jets.,,,Lions,http://www.rotoworld.com/recent/nfl/5583/golden-tate,5583
2018-09-16 20:05:00,"Tate was having a rather quiet day until he broke off an enormous gain in the fourth quarter, torching K’Waun Williams for a 67-yard pickup. That was the longest play from scrimmage for either team, beating Matt Breida’s third-quarter touchdown run by a single yard. The catch was also Tate’s longest since Week 17 of last year when he nabbed a 71-yard touchdown against the Packers. Even with Kenny Golladay taking on a much larger role this year, Tate continues to be a volume monster, amassing 28 targets over his first two games. Fantasy owners can start him with confidence against New England in Week 3.",Golden Tate,WR,Golden Tate chipped in with seven catches for 109 on 13 targets Sunday in Detroit’s Week 2 loss to the Niners.,,,Lions,http://www.rotoworld.com/recent/nfl/5583/golden-tate,5583
2018-09-23 23:54:00,"He led the Lions in targets and tied for a team high in yards. It was still a mostly quiet night for Tate with Kenny Golladay and Marvin Jones doing all the scoring. Tate doesn’t play in two wide sets, but he’s still getting 80 percent of snaps. He's a Week 4 FLEX against the Cowboys.",Golden Tate,WR,Golden Tate caught 6-of-8 passes for 69 yards in Week 3 against the Patriots.,,,Lions,http://www.rotoworld.com/recent/nfl/5583/golden-tate,5583
2018-09-30 11:21:00,"Tate was considered a game-time decision after injuring his hip at practice this week but he'll be out there for Sunday's 1 PM ET start. Kenny Golladay has been playing ahead of Tate in two-wide sets this year but Tate has still been productive, tallying 257 yards and a touchdown on 20 catches through three games. He'll be in play as a borderline WR2 against Dallas.",Golden Tate,WR,"NFL Network's Ian Rapoport reports Golden Tate (questionable, hip) will play Week 4 against the Cowboys.",https://twitter.com/RapSheet/status/1046413638200963072,Ian Rapoport on Twitter,Lions,http://www.rotoworld.com/recent/nfl/5583/golden-tate,5583
2018-09-30 16:12:00,"It seemed that whenever the Lions needed a big play on Sunday, Tate was there waiting to unleash mayhem on Dallas. The veteran slot man got his day started with a masterful 45-yard touchdown, making Jeff Heath and Jordan Lewis miss on his way to the end zone. Tate came up huge on the Lions' final drive, dusting Xavien Woods for a 35-yard pick-up before capping the drive with a 38-yard touchdown on a deep heave from Matthew Stafford, which gave Detroit a one-point lead with 2:17 left in the fourth quarter. This was Tate's first career game with 100-plus yards and two touchdowns. The stud 30-year-old will hope to keep the train rolling when the Lions return home to face Green Bay in Week 5.",Golden Tate,WR,Golden Tate secured eight catches for 132 yards and two touchdowns on eight targets Sunday in the Lions’ Week 4 loss to the Cowboys.,,,Lions,http://www.rotoworld.com/recent/nfl/5583/golden-tate,5583
2018-10-07 17:47:00,"Tate came back to earth after his 8-132-2 day in Dallas last week.  Matthew Stafford attempted just 26 passes with the Lions smashing the Packers 24-0 at halftime.  Tate didn't get his first catch until late in the second quarter.  A borderline WR1/2, Tate and the Lions are off until Week 7 at the Dolphins.",Golden Tate,WR,Golden Tate caught 5-of-7 targets for 42 yards in the Lions' Week 5 win over the Packers.,,,Lions,http://www.rotoworld.com/recent/nfl/5583/golden-tate,5583
2018-10-21 17:00:00,"Tate had the most yards from scrimmage of the Lions' ""big three"" at receiver. It was a quiet day for all involved with the Lions gutting the Dolphins on the ground. The Lions had their biggest rushing day since 1997. With just 78 yards receiving over his past two games, Tate will look to get cooking again as a mid-range WR2 against the Seahawks in Week 8.",Golden Tate,WR,"Golden Tate caught 4-of-6 targets for 36 yards in the Lions' Week 7 win over the Dolphins, adding a 30-yard rush.",,,Lions,http://www.rotoworld.com/recent/nfl/5583/golden-tate,5583
2018-09-30 19:36:00,Baldwin was playing in his first game since exiting Week 1 with a knee injury after he missed the entire preseason with a knee injury to his other knee. Baldwin lead the Seahawks in targets on Sunday and will enter Week 5 as a lower-end WR2 option against a Rams team that has been vulnerable to interior wideouts.,Doug Baldwin,WR,Doug Baldwin caught 5-of-7 passes for 41 yards in Sunday's Week 4 win over the Cardinals.,,,Seahawks,http://www.rotoworld.com/recent/nfl/6825/doug-baldwin,6825
2018-10-07 20:25:00,"Baldwin appeared to play his normal complement of snaps and did not look hampered by his knee injury as he blocked play after play. The real problem was Russell Wilson attempted just 21 passes as Seattle consistently gashed the Rams' defense on the ground. Baldwin should have better games moving forward, but Seattle's new emphasis on the running game is very concerning for his rest-of-season outlook. He should be considered a WR3 next week against the Raiders.",Doug Baldwin,WR,Doug Baldwin caught his only target for one yard in the Seahawks' Week 5 loss to the Rams.,,,Seahawks,http://www.rotoworld.com/recent/nfl/6825/doug-baldwin,6825
2018-10-14 16:05:00,"Baldwin's one-target Week 5 game sent the fantasy community into a tailspin, but he rebounded for a solid game against an Oakland defense that has struggled mightily to cover the slot.  Baldwin's eight targets were easily a team high; the next-closest Seahawks pass catcher had only four.  Despite his slow start, Baldwin will emerge from Seattle's Week 7 bye as an every-week fantasy WR2.  He is a recommended buy-low target in fantasy leagues.",Doug Baldwin,WR,Doug Baldwin caught 6-of-8 targets for 91 yards in the Seahawks' Week 6 win over the Raiders.,https://twitter.com/johnpboyle/status/1050160802550837249,John Boyle on Twitter,,http://www.rotoworld.com/recent/nfl/6825/doug-baldwin,6825
2018-09-09 20:02:00,"Watkins was targeted on Patrick Mahomes' first pass of the game but ended up getting out-targeted by both Tyreek Hill and Travis Kelce. That's not surprising, of course. Watkins had to contend with a few poor throws from Mahomes, though he did catch a blazing, low fastball for his second reception. Watkins is going to have big games in the Chiefs' high-octane offense, but they will be harder to see coming than Hill or Kelce's. He is best treated as a WR4 in fantasy.",Sammy Watkins,WR,Sammy Watkins caught 3-of-5 targets for 21 yards in the Chiefs' Week 1 win over the Chargers.,,,Chiefs,http://www.rotoworld.com/recent/nfl/9388/sammy-watkins,9388
2018-09-16 17:33:00,"The Chiefs made a point of getting Watkins going after his quiet Week 1, targeting him five times in the first 16 minutes. Despite the obvious intent, Watkins' usage did not feel forced. He was running fluidly in the Chiefs' high-octane attack. Watkins is going to be a feast-or-famine player behind Tyreek Hill and Travis Kelce, but today serves as a good reminder of his unusual upside for a WR3/4.",Sammy Watkins,WR,"Sammy Watkins caught 6-of-7 targets for 100 yards in the Chiefs' Week 2 win over the Steelers, adding 31 yards on an end around.",,,Chiefs,http://www.rotoworld.com/recent/nfl/9388/sammy-watkins,9388
2018-09-23 17:49:00,"He added another 20 yards on two carries. Watkins' role in the passing game expanded last week, and he hauled in his first touchdown with the Chiefs in this game. The score was a 12-yard reception late in the second quarter in which Watkins ran through a few tacklers. An emerging part of the best offense in the league, Watkins will be an upside WR3 next week in Denver.",Sammy Watkins,WR,Sammy Watkins hauled in 5-of-8 targets for 55 yards and a touchdown in the Chiefs' Week 3 win over the 49ers.,,,Chiefs,http://www.rotoworld.com/recent/nfl/9388/sammy-watkins,9388
2018-10-01 21:01:00,Watkins exited midway through the first half after catching no passes on one target.  Demarcus Robinson and Chris Conley will see increased reps behind Tyreek Hill for however long Watkins is out.  He's questionable to return.,Sammy Watkins,WR,Sammy Watkins exited Week 4 against the Broncos with a hamstring injury.,,,Chiefs,http://www.rotoworld.com/recent/nfl/9388/sammy-watkins,9388
2018-10-01 21:30:00,"He went catch-less on one target before leaving midway through the first half.  On a short week ahead of Week 5 against the Jaguars, Watkins will be up against it to play.  He wouldn't be a recommended play in that matchup anyway.  Chris Conley and Demarcus Robinson are next up on the depth chart.",Sammy Watkins,WR,Sammy Watkins (hamstring) has been ruled out for the remainder of Week 4 against the Broncos.,,,Chiefs,http://www.rotoworld.com/recent/nfl/9388/sammy-watkins,9388
2018-10-07 08:25:00,"Watkins is ready to lace 'em up after getting in a limited week of practice. The 25-year-old should avoid Jalen Ramsey, but he still gets a difficult matchup against one of the league's premier secondaries. It's also worth noting that rain has been falling all morning in Kansas City. Even with quarterback Patrick Mahomes on an insane hot streak, Watkins is best viewed as a WR3/4 against the Jags.",Sammy Watkins,WR,"Sammy Watkins (questionable, hamstring) is expected to play Week 5 against the Jaguars.",https://twitter.com/RapSheet/status/1048848653446795264,Ian Rapoport on Twitter,Chiefs,http://www.rotoworld.com/recent/nfl/9388/sammy-watkins,9388
2018-10-07 11:27:00,"It appeared as if Watkins would miss some time after leaving last week's game with a hamstring injury, but he was able to participate all week in practice and is ready to go. Perhaps he is slightly limited, and he faces a tough matchup. Even so, he is worth using as a WR3 as a major cog in a great offense.",Sammy Watkins,WR,Sammy Watkins (hamstring) is active for Week 5 against the Jaguars.,,,Chiefs,http://www.rotoworld.com/recent/nfl/9388/sammy-watkins,9388
2018-10-07 16:54:00,"Watkins entered the game nursing a hamstring injury, but he looked healthy on Sunday. His biggest play of the day came when he found a hole in zone coverage for a 33-yard gain on third down in the first half. Clearly healthy and a major cog in the best offense in the league, Watkins will be an upside WR3 play next week in New England.",Sammy Watkins,WR,Sammy Watkins hauled in 6-of-8 targets for 78 yards in the Chiefs' Week 5 win over the Jaguars.,,,Chiefs,http://www.rotoworld.com/recent/nfl/9388/sammy-watkins,9388
2018-10-21 23:52:00,"Watkins was on his way to another quiet game, but he salvaged his night with a 50-yard catch to open the second half. He wasn't much of a factor, though his seven targets were behind only Tyreek Hill. Watkins got banged up late in the fourth quarter but wasn't announced with an injury. He'll have a tough matchup with Denver's secondary in Week 8.",Sammy Watkins,WR,Sammy Watkins caught 4-of-7 passes for 74 yards in Week 7 against the Bengals.,,,,http://www.rotoworld.com/recent/nfl/9388/sammy-watkins,9388
2018-09-09 16:19:00,"Stewart got some run after Wayne Gallman left with an injury, but he was the clear No. 3 back before that. Even if something happened to Saquon Barkley, Stewart would not be an enticing fantasy play. He does not need to be rostered in any format.",Jonathan Stewart,RB,Jonathan Stewart rushed twice for eight yards in the Giants' Week 1 loss to the Jaguars.,,,Giants,http://www.rotoworld.com/recent/nfl/4650/jonathan-stewart,4650
2018-09-09 14:50:00,"Gallman was working as the clear No. 2 running back behind Saquon Barkley, but he picked up a knee injury in the third quarter. Jonathan Stewart, who has not lost a step, will serve as the backup while Gallman is out.",Wayne Gallman,RB,Giants RB Wayne Gallman (knee) is questionable to return Week 1 against the Jaguars.,,,Giants,http://www.rotoworld.com/recent/nfl/12309/wayne-gallman,12309
2018-09-09 16:52:00,"Gallman left Week 1 against the Jaguars with a knee injury, but he said that was just precautionary. The sophomore was working as the No. 2 back before going down.",Wayne Gallman,RB,Wayne Gallman (knee) expects to play Week 2.,https://twitter.com/rydunleavy/status/1038890389976047617,Ryan Dunleavy on Twitter,,http://www.rotoworld.com/recent/nfl/12309/wayne-gallman,12309
2018-09-09 16:59:00,"He finished second among Indy backs in touches behind Jordan Wilkins (17).  Hines was used heavily on screens and also gained 17 yards on a route where he lined up at wide receiver.  Even when Marlon Mack (hamstring) returns, Hines has a chance to carve out PPR flex value in this catch-first role.  The Colts are playing dink-and-dunk passing offense, and Hines' game suits that style of play.",Nyheim Hines,RB,Nyheim Hines rushed five times for 19 yards and caught 7-of-9 targets for 33 yards in the Colts' Week 1 loss to the Bengals.,,,Colts,http://www.rotoworld.com/recent/nfl/13209/nyheim-hines,13209
2018-09-16 17:52:00,"Hines impressed with a spinning, eight-yard touchdown dash in the second quarter but was a non-factor otherwise. All but two of his touches came in the first half. Hines spent most of the afternoon working behind Jordan Wilkins and Marlon Mack and that will likely be the case again next week against the Eagles. The fourth-round rookie is just a bench stash at this point.",Nyheim Hines,RB,Nyheim Hines contributed seven yards and a touchdown on four carries while catching his lone target for a loss of two yards Sunday in the Colts’ Week 2 win over the Redskins.,,,Colts,http://www.rotoworld.com/recent/nfl/13209/nyheim-hines,13209
2018-09-23 17:30:00,"Hines ""led"" the Colts backfield in Week 3, but hardly was noteworthy. Through three games, Hines has carried 14 times for 44 yards while catching 13 passes for 56 yards. He is not a fantasy option Week 4 against the Texans.",Nyheim Hines,RB,Nyheim Hines rushed five times for 18 yards while catching 5-of-5 targets for 25 yards in Sunday's Week 3 loss to the Eagles.,,,Colts,http://www.rotoworld.com/recent/nfl/13209/nyheim-hines,13209
2018-09-30 17:21:00,"Hines' 11 targets tied with Chester Rogers for the team lead on a day Andrew Luck uncorked a career-high 62 pass attempts.  With no Jack Doyles (hip) and T.Y. Hilton in and out of the game with chest and hamstring injuries, Hines became Luck's most trustworthy option.  Both of his scores were red-zone successes, from 14 and nine yards out.  The 14-yarder was an incredible leaping catch over the top of Tyrann Mathieu.  With the Colts having zero run game, Hines is essentially the extension of their nonexistent rushing offense.  He needs to be owned in all formats.",Nyheim Hines,RB,Nyheim Hines rushed four times for 10 yards and caught 9-of-11 targets for 63 yards and two touchdowns in the Colts' Week 4 loss to the Texans.,,,Colts,http://www.rotoworld.com/recent/nfl/13209/nyheim-hines,13209
2018-10-14 17:39:00,"Hines dropped an early would-be touchdown on third-and-goal to force a field goal, and he wasn't heard from much after that.  Marlon Mack led the backfield in Week 6 touches and sparked the rushing attack with 89 yards on 12 carries.  In a multi-headed RBBC, Hines is suddenly back in the shaky PPR-flex-option mix.",Nyheim Hines,RB,Nyheim Hines rushed three times for 14 yards and caught 2-of-3 targets for 21 yards in the Colts' Week 6 loss to the Jets.,,,Colts,http://www.rotoworld.com/recent/nfl/13209/nyheim-hines,13209
2018-10-21 17:33:00,"Hines played well when called upon, which wasn't often with Marlon Mack in the midst of a career game. Mack wound up out-touching Hines by a substantial 21-6 margin while also losing the snap battle 38-17. Hines will continue to have a role, especially when Indy is playing from behind, but he's now a distant second to Mack in the Colts' backfield pecking order. The fourth-round rookie gets the Raiders on the road in Week 8.",Nyheim Hines,RB,Nyheim Hines tallied 47 yards on five carries while adding one catch for -5 yards on two targets Sunday in the Colts’ Week 7 victory over the Bills.,,,,http://www.rotoworld.com/recent/nfl/13209/nyheim-hines,13209
2018-09-09 12:02:00,He'll face a Bengals run defense that is missing WLB Vontaze Burfict (hamstring) but remains largely stout up front.  Of more concern for Wilkins' fantasy outlook is his RBBC with Christine Michael and Nyheim Hines.  New Colts coach Frank Reich was a committee-backfield proponent during his time in Philadelphia.,Jordan Wilkins,RB,Jordan Wilkins will be the Colts' starting running back in Week 1.,,,Colts,http://www.rotoworld.com/recent/nfl/13276/jordan-wilkins,13276
2018-09-09 16:45:00,"The good news is Wilkins led Indy's backfield with 17 touches compared to Nyheim Hines' 12 and Christine Michael's two.  The bad news is the Colts continued to struggle to run block, and Wilkins struggled for effiency on his opportunities.  Marlon Mack (hamstring) could also return as soon as Week 2, which would further muddy up the running back distribution.  At best, Wilkins will be a low-end flex option at Washington in the second game.",Jordan Wilkins,RB,Jordan Wilkins rushed 14 times for 40 yards and caught 3-of-3 targets for 21 yards in the Colts' Week 1 loss to the Bengals.,,,Colts,http://www.rotoworld.com/recent/nfl/13276/jordan-wilkins,13276
2018-09-16 14:23:00,"He went down about midway through the second quarter. Wilkins delivered 25 yards on five carries along with one catch for no gain upon exiting. With Wilkins banged up, Indy's backfield reps will be split between Marlon Mack and Nyheim Hines.",Jordan Wilkins,RB,Jordan Wilkins left Sunday's Week 2 game against the Redskins with an ankle injury and is questionable to return.,https://twitter.com/HolderStephen/status/1041390463964643329,Stephen Holder on Twitter,Colts,http://www.rotoworld.com/recent/nfl/13276/jordan-wilkins,13276
2018-09-16 17:11:00,"Wilkins left briefly after tweaking his ankle in the second quarter but the injury didn’t seem to bother him in the second half. The fifth-round rookie failed to impress in last week’s debut against Cincinnati (2.9 yards per carry) but he did a nice job of moving the chains in this one. His 18-yard scamper with under five minutes remaining in the fourth quarter essentially sealed the win for Indy. Wilkins out-touched teammate Marlon Mack by a slim 12-11 margin, though he held a decisive edge in yards from scrimmage (64-36). The Colts seem committed to using a timeshare at running back, so we’d expect similar usage for both players next week against the Eagles.",Jordan Wilkins,RB,Jordan Wilkins tallied 61 yards on 10 carries while collecting two catches for three yards on two targets Sunday in the Colts’ Week 2 win over Washington.,,,Colts,http://www.rotoworld.com/recent/nfl/13276/jordan-wilkins,13276
2018-09-23 17:23:00,"Wilkins started in place of Marlon Mack, but found little room to run as the Eagles dominated on the defensive front. Wilkins now has rushed 30 times for 120 yards with seven catches for 25 yards through three games. He is not a starting-caliber option heading into Week 4 versus the Texans.",Jordan Wilkins,RB,Jordan Wilkins rushed six times for 19 yards while catching two passes for one yard in Sunday's Week 3 loss to the Eagles.,,,Colts,http://www.rotoworld.com/recent/nfl/13276/jordan-wilkins,13276
