date,impact,player,position,report,source_link,source_text,team,url,player_id
2018-09-30 21:39:00,"Robinson's 20 yards and ensuing touchdown wouldn't ordinarily be a letdown, but it came on a day in which Mitchell Trubisky threw for career-highs in yards (354) and touchdowns (6). Normally the recipient during the majority of his drop backs, Trubisky instead fed backup RB Tarik Cohen (7-121-1), Taylor Gabriel (7-104-2), and Trey Burton (2-86-1) rather than A-Rob. Robinson should still be the primary beneficiary moving forward now that the Bears' offense appears to be clicking on all cylinders. Unless he's shadowed by premier CB Xavien Howard after the bye, Robinson will stay a low-end WR2 against the Dolphins.",Allen Robinson,WR,Allen Robinson caught 2-of-4 targets for 23 yards and one touchdown in the Bears' Week 4 victory over the Buccaneers.,,,Bears,http://www.rotoworld.com/recent/nfl/9297/allen-robinson,9297
2018-10-14 17:59:00,"Robinson found himself on the receiving end of a 12-yard touchdown strike from Mitchell Trubisky in the third quarter, which came immediately following Kyle Fuller's interception of Brock Osweiler. That marked his second touchdown in as many games. Robinson's other contributions included a nice back-shoulder catch for a 21-yard gain in the fourth quarter and drawing a pass interference flag that eventually led to a Bears touchdown. A-Rob gets a date with New England in Week 7.",Allen Robinson,WR,Allen Robinson pulled in five catches for 64 yards and a touchdown on six targets Sunday in Chicago’s Week 6 loss to the Dolphins.,,,Bears,http://www.rotoworld.com/recent/nfl/9297/allen-robinson,9297
2018-10-21 02:01:00,Robinson practiced Friday and was considered on track to play. He'll continue to start in 3-WR sets with Taylor Gabriel and slot wideout Anthony Miller. Robinson arguably has the toughest matchup (albeit a winnable one) among Chicago's wideouts as he'll likely draw shadow coverage from Stephen Gilmore. He remains a risky WR2 considering he tweaked his groin only four days ago.,Allen Robinson,WR,Allen Robinson (groin) is expected to play against the Patriots in Week 7.,https://twitter.com/AdamSchefter/status/1053888163259867137,Adam Schefter on Twitter,Bears,http://www.rotoworld.com/recent/nfl/9297/allen-robinson,9297
2018-10-21 11:31:00,"This was the expectation after Robinson got in a limited practice on Friday. He might not be 100 percent, but he is in a good spot in a game in which the Bears could be playing from behind. He remains a back-end WR2 despite the injury concern.",Allen Robinson,WR,Allen Robinson (groin) is active for Week 7 against the Patriots.,,,Bears,http://www.rotoworld.com/recent/nfl/9297/allen-robinson,9297
2018-10-21 17:32:00,"Robinson did not have anything to show for his early opportunities in this one. He was unable to get loose on a deep target on the opening drive, and he dropped what would have been a third-down conversion on the second series. His only catch of the first half went for just four yards, and he was somehow worse in the second half. He was targeted just once in the third quarter – an errant end-zone target – and he was not heard from after that. It is possible he aggravated his groin injury in the second half, but the Bears never announced an injury. The Jets are a good matchup next week, but Robinson’s health and Mitchell Trubisky’s play are concerns moving forward.",Allen Robinson,WR,Allen Robinson hauled in 1-of-5 targets for four yards in the Bears' Week 7 loss to the Patriots.,,,Bears,http://www.rotoworld.com/recent/nfl/9297/allen-robinson,9297
2018-09-09 20:29:00,"His total rushing yards were nice, but Zeke ultimately fell victim to OC Scott Linehan's mundane early-down rushing scheme behind an offensive line missing C Travis Frederick in the middle. He handled 15 of Dallas' 17 backfield carries, though, reassuring his bell-cow status. Zeke will have to overcome loaded boxes with all the touches he's bound to receive if he's going to finish as a top-three back.",Ezekiel Elliott,RB,Ezekiel Elliott rushed for 69 yards and one score on 15 carries while adding three catches for 17 yards on four targets in the Cowboys’ Week 1 loss to the Panthers.,,,Cowboys,http://www.rotoworld.com/recent/nfl/11265/ezekiel-elliott,11265
2018-09-16 23:30:00,"Elliott had a quiet night before scoring a six-yard fourth quarter touchdown. He was the Cowboys entire offense aside from a 64-yard Tavon Austin touchdown on the third play of the night. Despite playing behind an offensive line missing Travis Frederick, Elliott has managed 80 total yards and a touchdown in both games to start the year. He'll remain a locked-in top-five option for Week 3 against Seattle.",Ezekiel Elliott,RB,Ezekiel Elliott rushed 17 times for 78 yards and a touchdown and caught 5-of-6 passes for nine yards in the Cowboys' Week 2 win over the Giants on Sunday night.,,,Cowboys,http://www.rotoworld.com/recent/nfl/11265/ezekiel-elliott,11265
2018-09-23 20:53:00,"After opening the year with a pair of so-so games, Elliott played legitimately well on Sunday, particularly in the second half when he broke loose for 76 yards on only seven carries. Zeke’s longest gain came on a 26-yard burst in the fourth quarter, though Bradley McDougald spoiled it by stripping him at the end of his run, resulting in a turnover. Elliott has averaged 16 carries per game this year, which is well below the 24.2 he averaged last season. We’ll see what the 23-year-old can cobble up next week against the Lions.",Ezekiel Elliott,RB,Ezekiel Elliott totaled 127 yards on 16 carries while securing three-of-eight targets for 11 yards Sunday in the Cowboys’ Week 3 loss to the Seahawks.,,,Cowboys,http://www.rotoworld.com/recent/nfl/11265/ezekiel-elliott,11265
2018-09-30 16:11:00,"Zeke's 240 yards from scrimmage—140 of which came after halftime—set a career-high. Elliott was, for large stretches of the afternoon, the Cowboys' only source of offense. The third-year back got to stepping with a 38-yard touchdown off a screen pass late in the second quarter. He rumbled to a 41-yard run, his longest of the game, in the third quarter. Elliott made arguably his biggest contribution when he hauled in a 34-yard deep bomb from Dak Prescott, putting the Cowboys in field-goal range with under two minutes left in the fourth quarter. The Cowboys' offensive line has mostly struggled this year, but they went all out for Zeke in Week 4. Elliott, who currently leads the NFL with 426 rushing yards, will look to stay hot when he faces the Texans next week on Sunday Night Football.",Ezekiel Elliott,RB,Ezekiel Elliott exploded for 152 yards on 25 carries while also contributing four catches for a team-high 88 yards and a touchdown Sunday in Dallas’ Week 4 win over the Lions.,,,Cowboys,http://www.rotoworld.com/recent/nfl/11265/ezekiel-elliott,11265
2018-10-14 19:53:00,"Coming off a brutal outing against Houston in Week 5 (54 yards on 21 carries), Zeke was much better Sunday, shredding the Jags for 61 rushing yards in the second half. Elliott tallied his fourth touchdown of the year on a 15-yard scamper early in the fourth quarter. The Cowboys' offense isn't what it was a few years ago but Elliott has remained productive, leading the NFL with 586 rushing yards through six games. Even with his clunker against the Texans, Zeke has still cleared 100 yards rushing in three of his last four contests. He'll look to make it four out of five when he takes on the Redskins in Week 7.",Ezekiel Elliott,RB,Ezekiel Elliott rumbled to 106 yards and a touchdown on 24 carries while gaining 11 yards on his lone catch Sunday in Dallas’ Week 6 win over the Jaguars.,,,Cowboys,http://www.rotoworld.com/recent/nfl/11265/ezekiel-elliott,11265
2018-10-21 19:31:00,"Washington's defense kept Elliott bottled at the line of scrimmage, permitting just 2.2 YPC. He was in position to score on the goal line late in the fourth quarter, but Dak Prescott kept the ball and scampered over the middle and crossed the plain himself instead. Although his six targets were encouraging, it's the second straight week Zeke has been held under 12 yards receiving, and already the fourth time he's failed to reach that mark this season. His on-field usage and involvement remains that of a true bell-cow, though, keeping him as a weekly top-five option despite porous results in Dallas' passing game. The Cowboys are on bye in Week 8.",Ezekiel Elliott,RB,"Ezekiel Elliott handled 15 carries for 34 yards, tacking on two catches for the nine yards in the Cowboys' Week 7 loss to the Redskins.",http://www.espn.com/espn/now?nowId=21-41036283-4,ESPN.com,,http://www.rotoworld.com/recent/nfl/11265/ezekiel-elliott,11265
2018-09-23 16:48:00,"Allen continues to struggle to produce positive yardage -- he now has 32 yards on 16 carries this season -- but he also continues to find the end zone. His first score came on a 12-yard pass in which he was able to get the corner and dive for the pylon, and he added a one-yard rushing touchdown in the third quarter. He is going to offer next to nothing when he fails to score, but Allen is a weekly FLEX consideration because of his red-zone role.",Javorius Allen,RB,Javorius Allen rushed six times for seven yards and a touchdown and caught three passes for 19 yards and another score in the Ravens' Week 3 win over the Broncos.,,,Ravens,http://www.rotoworld.com/recent/nfl/10314/javorius-allen,10314
2018-09-30 23:56:00,"Allen played ahead of Alex Collins for most of the second quarter after Collins lost a goal-line fumble. He didn't have any highlights, but his workloads have been trending up. Allen will be a touchdown-dependent FLEX for Week 5 against the Browns.",Javorius Allen,RB,Javorius Allen rushed 10 times for 30 yards and caught two passes for 17 yards in Week 4 against the Steelers.,,,Ravens,http://www.rotoworld.com/recent/nfl/10314/javorius-allen,10314
2018-10-07 17:00:00,"Allen also lost a fumble on one his six catches. He out-touched Alex Collins 14-to-13 and once again entered the game for goal line opportunities, though he failed to convert. Allen has at worst forced a committee with Collins and has a firm grasp on receiving work in the Baltimore offense. He's arguably a safer fantasy option at this stage since he is siphoning goal line snaps. Allen will enter Week 6 as an RB2/FLEX option against the Titans with a larger boost in PPR formats.",Javorius Allen,RB,Javorius Allen rushed eight times for 34 yards while catching 6-of-8 targets for 44 yards in Sunday's Week 5 loss to the Browns.,,,Ravens,http://www.rotoworld.com/recent/nfl/10314/javorius-allen,10314
2018-10-14 20:49:00,"Only one week after out-touching (14-13) and out-snapping (50-27) teammate Alex Collins, Allen fell victim to Baltimore's early lead and ensuing run-heavy game script. Collins inevitably out-carried Buck 19-1 on the day. In a closer game, perhaps Allen would've been used more, but his week-to-week usage is a legitimate dice roll at this point given coach Jon Harbaugh's recent statement about just ""keeping Collins fresh."" Allen has a higher floor (and will be needed) as the team's only pass-catching back in Week 7 against the Saints.",Javorius Allen,RB,Javorius Allen rushed just one time for one yard and caught all three of his targets for 18 yards in the Ravens' Week 6 mauling of the Titans.,,,Ravens,http://www.rotoworld.com/recent/nfl/10314/javorius-allen,10314
2018-10-21 19:55:00,"Allen has four carries for four yards over his past two games. Alex Collins is hardly setting the world on fire, but Allen is not making a meaningful push for more work. Allen is a bottom-of-the-barrel, bye week fill-in RB3. The Ravens get the Panthers in Week 8.",Javorius Allen,RB,"Javorius Allen rushed three times for three yards in the Ravens' Week 7 loss to the Saints, adding three receptions for 21 additional yards.",,,,http://www.rotoworld.com/recent/nfl/10314/javorius-allen,10314
2018-09-09 20:15:00,"It was not the most efficient day, but Sutton showed off his talent on two 20-plus yard catches and worked as the clear No. 3 receiver. He could struggle for consistent targets behind Emmanuel Sanders and Demaryius Thomas, but Sutton offers some deep-league value already and would be a plug-and-play starter if anything happened to the top-two receivers.",Courtland Sutton,WR,Courtland Sutton hauled in 2-of-5 targets for 45 yards in the Broncos' Week 1 win over the Seahawks.,,,Broncos,http://www.rotoworld.com/recent/nfl/13129/courtland-sutton,13129
2018-09-16 19:52:00,"Sutton's lowly line was due to two near-misses as he has a 14-yard touchdown called back when he stepped out of bounds as well as another potential 35-yard gain when he failed to catch a pass cleanly down the sideline. The rookie has a promising 11 targets through two games, but has managed just three receptions for 54 yards. He is only a bench stash at this juncture of the season as the Broncos head to Baltimore in Week 3.",Courtland Sutton,WR,Courtland Sutton caught 1-of-6 targets for nine yards in Sunday's Week 2 win over the Raiders.,,,Broncos,http://www.rotoworld.com/recent/nfl/13129/courtland-sutton,13129
2018-09-23 17:28:00,"Both of his catches went for big gains, and one converted a third-and-long. Sutton continues to look good when he gets an opportunity, but he has now failed to top two catches in each of the first three games. He is just a bench stash.",Courtland Sutton,WR,Courtland Sutton hauled in 2-of-3 targets for 37 yards in the Broncos' Week 3 loss to the Ravens.,,,Broncos,http://www.rotoworld.com/recent/nfl/13129/courtland-sutton,13129
2018-10-07 17:46:00,"Sutton caught an early eight-yard touchdown and drew another end-zone target later on, only to hobble off the field with a leg injury in the second half.  Sutton's status for Week 6 against the Rams is unclear.  His injury led to more playing time for DaeSean Hamilton, who caught three balls for 44 yards.",Courtland Sutton,WR,Courtland Sutton caught 2-of-6 targets for 18 yards and a touchdown in the Broncos' Week 5 loss to the Jets.,,,Broncos,http://www.rotoworld.com/recent/nfl/13129/courtland-sutton,13129
2018-10-14 19:54:00,"Sutton was also called for a down-field blocking penalty that cost the Broncos a potential touchdown in the fourth quarter. 41 of Sutton's yards came on an underthrown pass from Case Keenum. His 58 yards were a new season/career-high, which tells you most of what you need to know about Sutton's re-draft value as Keenum's No. 3 wideout.",Courtland Sutton,WR,Courtland Sutton caught 3-of-4 targets for 58 yards in the Broncos' Week 6 loss to the Rams.,,,Broncos,http://www.rotoworld.com/recent/nfl/13129/courtland-sutton,13129
2018-09-16 18:58:00,"Cooks seems to be perfectly comfortable in Los Angeles. After going for 87 yards in the season opener, he was even better in this game. He probably should have had a long touchdown, but Jared Goff underthrew him, forcing him to come back to the ball and the defender. Cooks made another big play in the fourth quarter, going high for a catch to convert a third down. The Rams should have a tougher time against the Chargers next week, but Cooks will be a top-20 option all season.",Brandin Cooks,WR,Brandin Cooks hauled in 7-of-9 targets for 159 yards in the Rams' Week 2 win over the Cardinals.,,,Rams,http://www.rotoworld.com/recent/nfl/9404/brandin-cooks,9404
2018-09-23 21:13:00,"Cooks fell just one foot short of his first touchdown in a Rams uniform when he pulled in a tightly covered target across the middle. Despite not having a touchdown yet, Cooks looks very comfortable with Jared Goff and coach Sean McVay is crafting up a lot of plays to get Cooks involved. The speedster will look to find the end zone next Thursday against the Vikings as a WR2.",Brandin Cooks,WR,Brandin Cooks caught 7-of-8 targets for 90 yards in the Rams' Week 3 win over the Chargers.,,,Rams,http://www.rotoworld.com/recent/nfl/9404/brandin-cooks,9404
2018-10-07 17:53:00,"Cooks took a scary hit to the head at the end of a catch in the two-minute drill. He was down on the field for a couple minutes before walking off on his own. He was taken straight into the locker room, and it would be a shock if he returns to this game. The catch on which he was injured was called back on a penalty -- astoundingly not for the hit -- so Cooks exited the game without recording a catch.",Brandin Cooks,WR,Brandin Cooks exited Week 5 against the Seahawks after taking a big helmet-to-helmet hit at the end of the second quarter.,,,Rams,http://www.rotoworld.com/recent/nfl/9404/brandin-cooks,9404
2018-10-14 14:37:00,"As is Cooper Kupp (concussion). After it initially looked like they might be short-handed on offense, the Rams will be full strength as they play in a blustery Denver. Inactive for the Rams are K Greg Zuerlein, DB Darious Williams, RB John Kelly, OLB Trevon Young, C Brian Allen, DT Sebastian Joseph-Day and DT Tanzel Smart.",Brandin Cooks,WR,Brandin Cooks (concussion) is active for Week 6 against the Broncos.,,,Rams,http://www.rotoworld.com/recent/nfl/9404/brandin-cooks,9404
2018-10-14 19:39:00,Cooks caught a 44-yard pass on the Rams' third play from scrimmage and went into witness protection thereafter. The Rams' passing attack never really got in gear as it dealt with injury to Cooper Kupp and watched Todd Gurley go bonkers on the ground. Cooks should bounce back as a high-end WR2 for Week 7 against the 49ers.,Brandin Cooks,WR,Brandin Cooks caught 2-of-6 targets for 53 yards in the Rams' Week 6 win over the Broncos.,,,Rams,http://www.rotoworld.com/recent/nfl/9404/brandin-cooks,9404
2018-10-21 19:50:00,"The Rams' passing game did not have to do much in this one, but Cooks still had a good day. His best play was a 19-yard touchdown in the second quarter in which he ran a great route to get open. The offense should have more to do next week against the Packers, and Cooks will be a borderline WR1 in that good matchup.",Brandin Cooks,WR,Brandin Cooks hauled in 4-of-5 targets for 64 yards and a touchdown in the Rams' Week 7 win over the 49ers.,https://twitter.com/RamsNFL/status/1051142614475399168,Los Angeles Rams on Twitter,,http://www.rotoworld.com/recent/nfl/9404/brandin-cooks,9404
2018-09-23 16:05:00,"Watson had an ugly first half, but salvaged his game with two late scoring drives. Both his touchdowns were on dumpoffs, with his second one not coming until the final play. Watson added a team-leading 36 rushing yards on five carries. After a shaky Week 1, Watson has 300-plus total yards in consecutive games. He'll be a top-five option for a matchup with the Colts next week.",Deshaun Watson,QB,"Deshaun Watson completed 24-of-40 passes for 385 yards, two touchdowns, and an interception in the Texans' Week 3 loss to the Giants.",,,Texans,http://www.rotoworld.com/recent/nfl/12151/deshaun-watson,12151
2018-09-30 17:34:00,"Watson rushed six times for an additional 41 yards and a third touchdown.  This was a true up-and-down shootout that kind of lulled through the first half before exploding after the break.  The Texans blew a 28-10 lead and had to go to overtime for the win.  Watson's two touchdowns were three- and five-yard hookups to Will Fuller and DeAndre Hopkins, respectively, and his rushing score was a five-yard scamper to cap a 15-play drive.  Watson has now topped 300 yards passing in three-straight games ahead of a Week 5 date with the Cowboys where he'll remain a QB1.",Deshaun Watson,QB,"Deshaun Watson completed 29-of-42 passes for 375 yards, two touchdowns, and one interceptions in the Texans' Week 4 win over the Colts.",,,Texans,http://www.rotoworld.com/recent/nfl/12151/deshaun-watson,12151
2018-10-07 23:51:00,"It was an uneven game from Watson, but he bounced back from a late fourth-quarter interception to rally the Texans to an overtime win.  Watson had a larger role in the running game with Alfred Blue sidelined, rushing for 40 yards on 10 carries. He took some huge hits and was stuffed on multiple goal-line runs, but managed to avoid injury. After a slow start, Watson has looked much closer to the quarterback he was in 2017. He gets a plus matchup with Buffalo in Week 6.",Deshaun Watson,QB,Deshaun Watson completed 33-of-44 passes for 375 yards with a touchdown and an interception in Houston's Week 5 win over Dallas.,,,Texans,http://www.rotoworld.com/recent/nfl/12151/deshaun-watson,12151
2018-10-14 11:31:00,"There was never much doubt about his status despite a lingering chest injury. Watson is a locked-in QB1 this week. Houston declared CB Aaron Colvin (ankle), WR Vyncint Smith, ILB Brian Peters (ankle), OLB Deashon Hall, OT David Sharpe, DE Carlos Watkins, and DE Christian Covington inactive for Week 6.",Deshaun Watson,QB,Deshaun Watson (chest) is active for Week 6 against the Bills.,,,Texans,http://www.rotoworld.com/recent/nfl/12151/deshaun-watson,12151
2018-10-14 16:01:00,"Watson also fumbled three times, losing one, and was sacked seven times in a game he almost certainly wants to forget. Things started out perfectly for the quarterback, who was five-for-five with 62 yards and a touchdown to start the game, but it all went downhill from there. Houston's only meaningful offense in the second half came when Will Fuller drew a defensive pass interference play in the end zone. Houston could not get convert that into a touchdown, but the defense bailed them out with a pick-six to close out the game. Watson can point to a tough matchup, but the road will not get any easier next week in Jacksonville. He will be just a borderline QB1 in that matchup.",Deshaun Watson,QB,"Deshaun Watson completed 15-of-25 passes for 177 yards, one touchdown, and two interceptions in the Texans' Week 6 win over the Bills.",,,Texans,http://www.rotoworld.com/recent/nfl/12151/deshaun-watson,12151
2018-10-21 16:39:00,"""He’s playing hurt,"" coach Bill O’Brien conceded after the game. Watson is believed to be dealing with lung and ribs injuries, which are why he’s been listed with a ""chest"" ailment on weekly injury reports. The Texans committed to their rushing attack in Sunday’s victory rather than leaning on Watson to drop back to pass against Jacksonville’s talented-if-underachieving front. Watson now has a quick turnaround in Week 8 against the Dolphins on Thursday Night Football. Due to the injuries, Watson has become an increasingly risky fantasy bet coming off consecutive sub-par box-score games.",Deshaun Watson,QB,Deshaun Watson completed 12-of-24 passes for 139 yards and a touchdown and rushed seven times for 13 yards in the Texans’ Week 7 win over the Jaguars.,,,Texans,http://www.rotoworld.com/recent/nfl/12151/deshaun-watson,12151
2018-10-25 23:43:00,"Watson added a 14-yard scramble. As you can see, Watson had more touchdowns than incompletions against a truly embarrassing Dolphins defense. Matt Burke's unit was leaving star players like DeAndre Hopkins and Will Fuller completely uncovered for touchdowns, while little-featured rookie TE Jordan Thomas was able to break free for two scores. Watson was extending plays all night with his legs. Watson and the Texans have now won five straight after opening the year 0-3. The Broncos are on tap for Week 9. A concern for Watson is Fuller's health after he left Thursday's game with a knee issue.",Deshaun Watson,QB,"Deshaun Watson completed 16-of-20 passes for 239 yards and five touchdowns in the Texans' 42-23, Week 8 win over the Dolphins.",,,,http://www.rotoworld.com/recent/nfl/12151/deshaun-watson,12151
2018-09-10 23:21:00,"Powell got the start for the Jets, playing the first six snaps before ceding work to Isaiah Crowell, who answered in a big way with a 10-102-2 rushing line.  The two figure to split work pretty evenly for much of the season, but Powell would seem to be the favorite anytime the Jets are chasing points.  That wasn't the case tonight with New York winning by 31.  Powell will be on the RB3/FLEX map next week in the home opener against the Dolphins.",Bilal Powell,RB,Bilal Powell rushed 12 times for 60 yards and caught 1-of-2 targets for five yards in the Jets' Week 1 win over the Lions.,,,Jets,http://www.rotoworld.com/recent/nfl/6594/bilal-powell,6594
2018-09-16 18:02:00,"Powell was out-touched 14 to 10 by Isaiah Crowell in this one, but Powell's superior versatility resulted in a far superior fantasy day.  Crowell struggled as a rusher (12/35/0) and was targeted just three times in the passing game.  In a near-even timeshare, both backs will be Week 3 flex options at Cleveland.",Bilal Powell,RB,"Bilal Powell rushed five times for six yards, but caught 5-of-6 targets for 74 yards and a touchdown in the Jets' Week 2 loss to Miami.",,,Jets,http://www.rotoworld.com/recent/nfl/6594/bilal-powell,6594
2018-09-20 23:59:00,"Powell failed to corral his lone target in the passing game. Powell managed to out-rush Isaiah Crowell 73-34 on two fewer carries, though Crowell converted a pair of goal-line looks for scores. There just isn't much separation here right now. Powell will be the preferred play against the Jaguars' daunting defense in Week 4 as the Jets look to counteract the Jags' pass rush with short throws.",Bilal Powell,RB,Bilal Powell rushed 14 times for 73 yards in the Jets' Week 3 loss to the Browns.,,,Jets,http://www.rotoworld.com/recent/nfl/6594/bilal-powell,6594
2018-10-18 21:33:00,"A fourth-round rookie, Hamilton got rolled into on a return. It did not look good.",DaeSean Hamilton,WR,Broncos PR DaeSean Hamilton was forced from Thursday's game against the Cardinals with a knee injury and will not return.,https://twitter.com/psmyth12/status/1053093881997221888,Patrick Smyth on Twitter,Broncos,http://www.rotoworld.com/recent/nfl/13174/daesean-hamilton,13174
